36,how to use waste products,Training,Waste product management,,,,,,,"If iam given transport means or sponsored in some other way to go for tours outside my area.
we cant get access to improved coffee seedlings.",Training,Farm demonstrations,,Inputs,Seedlings,,,Lack of tools to use like hoes,Inputs,Equpiment,,,,,,,"When i see a branch that had dried,i cut it off and burn it so that the disease does not spread to the whole plant",Cut & Burn Affected Area,,,,,All that i have been taught.,some farmers take long to adopt these ideas.,People lack necessities to implement new skills,,,More training.,Training,,,And investing in plantations,Investment,,Farm Costs,,i take good care of my farm,,,,,,,,,At times i get loan and i fail to pay back.,Repayment Hard,,
37,how to grow coffee because its my main cash crop,Training,Good agricultural practices,Coffee,,,,,,Helping us with what to use to wipe out the pests and diseases.,Training,Pest management,,,,,,alot of weeds in my banana plantation,Weeds,,,,,,,,I use my small hoes since thats what i have,Equipment,,,,,I would tell them what i have been taught so that we all adopt it and improve our farming skills hence increasing our income.,Some refuse to take on the advice.,Fellow farmers do not accept training,,,To invite them for trainings so that they get first hand information.,Training,,,also saves,Savings,,,,we harvested alot,,,,,,,,,No big challenge.,No Challenge,,
38,"To teach me about how to fight coffee pests.
visits on my farm to trach me more improved methods of farming",Training,Pest management,,Training,Farm demonstrations,,,,How to fight the pests that are destroying and drying our coffee.,Training,Pest management,,,,,,"Drying up of coffee trees.
when coffee is still young,it turns black in colour and the black branches fall off.
Pests and diseases.",Pests,,Water,Access,,,,,I sometimes mulch and add fertilizers,Soil mangement,Fertilizer,Mulching,,,I would teach them depending on how i have been taught.,some misinterprete the message and do not take it on,Fellow farmers do not accept training,,,When we keep getting trainings.,Training,,,buy salt,Food,,,,Alot of drought,,,,,,,,,High interest rate.,High Interest,,
39,More training on how to make my own manure and money.,Training,Compost,Manure,,,,,,When i get materials and more training so that i become an expert in bee keeping.,Training,Bee keeping,,Inputs,Materials,,,"pests and diseases
Drought
Lack of finances",Pests,,Weather,Drought,,Finance,,,"when a plant has been affected by coffee wilk,i cut them off and burn them from home.
I also informed field workers and they came and took a branch so as to carry out research but they have never got back to me.",Cut & Burn Affected Area,,,,,"I would visit them and teach them what to do, i would also help them with whatever i have just like many people come to my farm and get coffee seedlings.",Not understanding each other,Fellow farmers do not accept training,,Communication,more trainings and sensitization.,Training,,Sensitization,we buy salt,Food,,,,Lack of fertilizers,,,,,,,,,Many proceedures to get aloan,Background Check,,
40,How to fight banana wilt disease in my plantation.,Training,Pest management,Bananas,,,,,,When i get support from our society inform of money so that we can all put our ideas to work.,Finance,Implement new ideas,,,,,,"Pests and diseases.
lack of finances",Pests,,Finance,,,,,,when i find an affected plant i cut it off and burn it,Cut & Burn Affected Area,,,,,I would gather all of them and teach them or can go house to house,Misintepretation and they tend to think we have alot of time and land to waste.,Fellow farmers do not accept training,,Time,Even when they invite them for trainings they refuse so they should not be bothered and left to do whatever they want.,NA,,,investing,Investment,,,,because of drought,,,,,,,,,High interest rates to pay back the loan,High Interest,,
41,how to grow coffee,Training,Good agricultural practices,Coffee,,,,,,If iam given financial help from our society and more advice in regards to that.,Finance,,,,,,,"Pests and diseases.
Drought.
lack of finances.",Pests,,Weather,Drought,,Finance,,,I cut the dried or affected parts on the coffee tree and burn them.,Cut & Burn Affected Area,,,,,I would teach them everything that i have been taught so as to improve our quality.,"Some do not believe and do not adopt until they have problems,that is when they come back for help.",Fellow farmers do not accept training,,,"If i have means of transport,it would be easy for me to find them wherever they are.",Travel,,,and basic needs,Daily Expenses,,,,Coffee wilt disease and no waste to use,,,,,,,,,"High interest rates
High bank charges",High Interest,,
42,How to fight the coffee diseases and maybe give us organic pesticides to spray them.,Training,Pest management,Coffee,Inputs,Organic,,,,If i get manure for my crops and maybe finances to be able to buy cattle.,Inputs,Fertilizer,Manure,,,,,pests and diseases.,Pests,,Finance,,,,,,I cut off the affected area and burn them,Cut & Burn Affected Area,,,,,All that i have been taught because it would improve our income.,Some are not interested.,Poor Committment,,,Organize more trainings.,Training,,,Do development projects,Farm Costs,,,,Hail storms,,,,,,,,,NONE,No Challenge,,
43,How to plant and take care of coffee,Training,Good agricultural practices,Coffee,,,,,,when i get financial assistance.,Finance,,,,,,,"Pests and diseases.
Lack of finances.",Pests,,Finance,,,,,,buy medicine for my cows and burn the affected plants,Cut & Burn Affected Area,,,Inputs,Medicine,When they have not gone to workshops i would tell them what i have learnt and how they can solve it.,Some do not want to attend workshops because they need to be facilitated.,Poor Committment,,,"Increase our standards of farming so that our farms attracts more visitors,we ought to be exemplary",Improve farming to attract visitors,,,To pay labours,Wages,,,,change of seasons,,,,,,,,,FAILURE TO SERVICE THE LOAN,Repayment Hard,,
44,How to grow and harvest good coffee,Training,Good agricultural practices,Coffee,Training,Harvesting,,Coffee,,"Since we are members of the society,we would appreciate it if we are supported with money which have no interests so that we also develop ourselves.",Finance,,,,,,,"Pests and diseases.
Natural calamities",Pests,,Finance,,,,,,I cut off the affected areas.,Cut & Burn Affected Area,,,,,I would tell them how they should carry out farming just as i have been taught.,Some people are slow in adopting ideas.,People lack necessities to implement new skills,,,More trainings so as to teach them.,Training,,,i buy matures,Farm Costs,,,,Pests and diseases,,,,,,,,,HIGH INTEREST RATES,High Interest,,
45,About how to grow good quality coffee,Training,Good agricultural practices,Coffee,Training,Good agricultural practices,Quality,Coffee,,when our society provides us with the  above materials and tools we would be very encouraged as other innovations come along.,Inputs,Materials,,Inputs,Equipment,,,"pests and diseases.
natural hazards",Pests,,Weather,Extreme,Natural disasters,,,,I cut off all the affected areas and burn them,Cut & Burn Affected Area,,,,,I would tell them exactly what i have been taught.,Most are stubborn and do not adopt the ideas,Fellow farmers do not accept training,,,More trainings.,Training,,,Hire labours in my farm,Wages,,,,Increased production,,,,,,,,,LOANS OFFICERS WANT BRIBES,Fraud,,
46,How to plant good quality with good yields.,Training,Good agricultural practices,Coffee,Training,Good agricultural practices,Quality,Coffee,,When i get enough money everything can be done.,Finance,,,,,,,Pests and diseases.,Pests,,,,,,,,i cut them off and burn them,Cut & Burn Affected Area,,,,,I would tell them exactly what they have told me,Some farmers are distant and therefore makes it difficult to communicate to them and share such valuable information.,Travel,,Communication,More trainings so that we all learn.,Training,,,Buy agricultural seeds.,Farm Costs,,,,Seasons are different affecting yields.,,,,,,,,,sometimes you get less than you would like.,Insufficient Disbursement Amount,,
47,I would like more help in growing looking after my coffee and bananas.,Training,Good agricultural practices,Coffee,Training,Good agricultural practices,,Bananas,,When am supported financially.,Finance,,,,,,,"Pests and diseases.
How to mulch because of lack of materials.",Pests,,Inputs,Fertilizer,Mulching,,,,i cut the dried coffee plants and throw them away.,Cut & Burn Affected Area,,,,,I would tell them exactly what i have been taught and i would even show them.,we have common problems affecting us so we all listen to each othetlr.,No Challenges,,,We should have very many meetings and also introduce the idea of change agents again since their contracts ended.,Training,,Farmer Promoters,I buy utensils,Daily Expenses,,,,Drought and hailstorms,,,,,,,,,sometimes you are given less money than you need,Insufficient Disbursement Amount,,
48,I lack information about what others are doing in regards to farming.,Information,Good agricultural practices,,,,,,,access to finances,Finance,,,,,,,"Pests diseases.
Shortage of labour.",Pests,,Labour ,Shortage,,,,,We cut the affected trees and plant new ones,Cut & Burn Affected Area,,,Replant,,"when i see someone who is doing something wrong i teach them like how to plant,prune and mulch.",Some do not adopt the ideas and think we are wasting time and resources.,Fellow farmers do not accept training,,Time,More trainings to teach us how to go about the problems and challenges.,Training,,,transport,Travel,,,,I built a good house,,,,,,,,,facility may not have enough money to  loan,Insufficient Disbursement Amount,,
49,"Pests and diseases affecting the coffee. 
coffee plants are becoming totally black.",Pest management,,,,,,,,enough training,Training,,,,,,,"Pests and diseases.
my coffee is turning yellow and also turns black.",Pests,,,,,,,,"we cut down the affected plants and burn them and since we do not have what to use,we first put them under the sun to dry.",Cut & Burn Affected Area,,,,,"Let me say when iam taught about making waste for my farm,i would teach them exactly how to use them",especially those who are not in the society do not easily understand.,Fellow farmers do not accept training,,,Increase trainings in the area.,Training,,,"paying labour, construct a house",Wages,,Investment,,The season was good,,,,,,,,,"delays,offer less, high intetest rate",Delayed Disbursement,,High Interest
50,How to fight pests and diseases,Pest management,,,,,,,,help from extension farmers,Training,Extension officer,,,,,,pests and diseases,Pests,,,,,,,,We are not allowed to spray coffee using pesticides so we either remove or cut off the affected areas and burn them.,Cut & Burn Affected Area,,,,,i would visit my friends and fellow farmers and show they exactly what i have been taught.,They first refuse my advice.,Fellow farmers do not accept training,,,More trainings so that they also attend in person.,Training,,,"paying loan, constructing a house",Loans,,Investment,,Alot drought leading to low yields,,,,,,,,,high interet cmplicate repayment,High Interest,,
51,I would have loved the information but problem is that i see iam growing old and the energy is also reducing but would like to continue farming with improved skills.,Information,,,Age,,,,,easy access to fertilizers,Inputs,Fertilizer,,,,,,No challenge.,None,,,,,,,,I cut the affected areas and burn them all,Cut & Burn Affected Area,,,,,What we have been taught and how to do it.,"When i take my time and reach someonea home and i teach them,some do not do what i teach them.",Fellow farmers do not accept training,,,More trainings should be done.,Training,,,taking care of parents,Family,,,,Pests and diseases were minimal,,,,,,,,,loan delays,Delayed Disbursement,,
52,How to plant and care for robusta coffee.,Training,Good agricultural practices,Coffee,,,,,,training,Training,,,,,,,"Pests and diseases.
Lack of finances.
Lack of tools to use for pruning anf materials when harvesting.",Pests,,Inputs,Equpiment,,Finance,,,I cut down the affected plants,Cut & Burn Affected Area,,,,,how to control pests,Others do not put them into action.,Fellow farmers do not accept training,,,More trainings should be carried.,Training,,,needs at home,Daily Expenses,,,,I have no problem.,,,,,,,,,limited shares,Shares,,
53,"I would like to be supported with cows for zero grazing and labour for farming.
Am also in need of fetilizers.",Livestock,Zero grazing,,Inputs,Labour,,,,Provision of financial support,Finance,,,,,,,"Pests and diaeases.
The cows normally fall sick especially during the dry season.",Pests,,Pests,Livestock health,,,,,"Farm pests and diseases.
When the coffee plants over grow,i find it hard to reach the upper parts of the coffee plants.",,,,,,practicing mulching,some find it hard to implement because of laziness or lack of money,People lack necessities to implement new skills,,,Increase the number of times trainings are carried out.,Training,,,things at home,Daily Expenses,,,,We have undergone alot of training in farming.,,,,,,,,,fear to fail to pay back,Repayment Hard,,
54,I need more training in farming.,Training,Good agricultural practices,,,,,,,provision of trainings,Training,,,,,,,"Pests and diseases.
lack of manure.",Pests,,Inputs,Fertilizer,Manure,,,,"When we meet in our society and table all our problems and seek for a collective solution as a society,i think all these problems will be eradicated.",Support ,Farmer societies,,,,how to rear bees,"There are good things only,i havent found any challenge",No Challenges,,,Bring more trainings about coffee growing.,Training,,,home needs,Daily Expenses,,,,Good season,,,,,,,,,high interest rate,High Interest,,
55,Farming techniques are very different so i would like to be trained morr.,Training,Good agricultural practices,,,,,,,get people to carry out these changes on the farm,Training,New ideas,,,,,,"Pests and diseases.
Lack of finances to put some ideas into action.
Lack of labour to work on the farm since i do farming alone and all the children are in school.",Pests,,Finance,New ideas,,Labour ,Shortage,,We try and get medicine for cows and also completely cut down the affected coffee plants.,Cut & Burn Affected Area,,,Inputs,Medicine,planting coffee,favourable time to reach the farmers,Time,,,proper time scheduling,Coordination,,,keeping in sacco,Group Contributions,,,,Its because i planted new coffee plants,,,,,,,,,no challenge,No Challenge,,
56,How and which materials to use for mulching.,Inputs,Compost,Mulching,,,,,,provision of more trainings,Training,,,,,,,"Pests and diseases.
Lack of finances.
My soil does not sustain other crops except coffee and bananas",Pests,,Finance,,,Soil mangement,Fertility,,I buy coffee hasks and grass and use for mulching.,Soil mangement,Fertilizer,Mulching,,,managing pests on a farm,long distances,Travel,,,organize meetings on a demonstration farm,Demonstration farm,,,"buy things at home like hens, goats",Daily Expenses,,Livestock,,its because of the long drought,,,,,,,,,Theres no challenge,No Challenge,,
57,To increase the training sessions so that we learn more new things.,Training,New ideas,,,,,,,increase on my farm,Inputs,Land,,,,,,"Lack of waste products and finances to buy them.
Lack of enough land.
Pests and diseases.",Finance,,Prices,Land,,Pests,,,When i get some money i hire some labour but rarely.,Labour,Hire,,,,proper mulching,most farmers are illiterate,Poor Education,Illiteracy,,make transportation easy,Funding to travel,,,"invests in business, home use",Investment,Micro-enterprise,Daily Expenses,,lack of fertilizers,,,,,,,,,paying back is not easy because of low production,Repayment Hard,Farming Challenges,
58,Improved farming because it covers alot of areas regarding farming.,Training,Good agricultural practices,,,,,,,sensitization on other ways to carry out mulching,Training,Mulching,,,,,,"Pests and diseases.
lack of tools and grasd for mulching",Pests,,Inputs,Fertilizer,Mulching,,,,I have started mulching and adding terraces.,Soil mangement,Fertilizer,Mulching,Terracing,,how to deal with pests,long distance,Travel,,,provision of transportation,Funding to travel,,,support home,Daily Expenses,,,,use of fertilizers,,,,,,,,,Getting less than you need,Insufficient Disbursement Amount,,
59,How to fight these pests and diseases,Training,Pest management,,,,,,,provision of support like trainings,Training,,,,,,,"Pests and diseases.
Lack of manure like cow dung.",Pests,,Inputs,Fertilizer,Manure,,,,The extension workers have taught us to cut off the affected area and burn them.,Support ,Extension officers,,Cut & Burn Affected Area,,soil management,transportation and long distances,Travel,,,provision of transport,Funding to travel,,,paying loans,Loans,,,,weather changes,,,,,,,,,delayed loan,Delayed Disbursement,,
60,How to grow and take care of coffee.,Training,Good agricultural practices,Coffee,,,,,,provision of support,Support,,,,,,,I have no one to help me do them on my farm and am too old to do them.,Labour ,Shortage,Age,,,,,,We cut down the affected trees and burn them,Cut & Burn Affected Area,,,,,zero grazing,farmers ask for material help which i might not have,Lack of information/resources/demonstrations,,,provision of some materials to the farmers,Training materials,,,home use,Daily Expenses,,,,good weather,,,,,,,,,there are high interest rates on loans,High Interest,,
61,mulching,Inputs,Compost,Mulching,,,,,,Trainings,Training,,,Inputs,Materials,,,drought and pests,Pests,,Weather,Drought,,,,,we use some very little manure which is ofcourse not enough,Soil mangement,Fertilizer,Manure,,,how to make a nursery bed,some are rigid,Fellow farmers do not accept training,,,offer more training,Training,,,buy household things,Daily Expenses,,,,weather was favourable,,,,,,,,,High intrest  rates,High Interest,,
62,planting coffee and bananas,Inputs,Seedlings,Coffee,Inputs,Seedlings,Coffee,,,Training materials,Training,,,,,,,pests,Pests,,,,,,,,I just throw waste products in my farm.,Throw away waste products,,,,,mulching,poot response from the farmers,Poor Committment,,,offer transportation,Funding to travel,,,needs at home,Daily Expenses,,,,incresead number of plantations,,,,,,,,,i have not yet got any problem,No Challenge,,
63,Mulching and cutting old coffee trees practically,Inputs,Compost,Mulching,,,,,,If we can get more trainings,Training,,,,,,,"pests and diseases, duplicated drugs",Pests,,Inputs,Duplicated drugs,,,,,to cut off the affected coffee trees,Cut & Burn Affected Area,,,,,how to prevent pests,Facilitation like breakfast and lunch plus materials for the training.,Lack of information/resources/demonstrations,,,sensitisation,Sensitization,,,buy basic needs at home,Daily Expenses,,,,soil management,,,,,,,,,not any problem,No Challenge,,
64,"harvesting coffee, mulching, and drying coffee.",Inputs,Compost,Mulching,Training,Harvesting,Training,Coffee drying,,"Mobile network
Funds",Infrastructure,Mobile network,,Finance,,,,pests and weather changes,Pests,,Weather,Changing,,,,,cutting away the infected trees,Cut & Burn Affected Area,,,,,value addition,transportation and facilitation,Travel,,Lack of information/resources/demonstrations,provision of support,Training materials,,,"lubricant for vehicle and fuel, buying household needs",Car,,Daily Expenses,,i added manure in the farm,,,,,,,,,people dont pay promptly so its a big problem.,Delayed Disbursement,,
65,coffee planting,Training,Good agricultural practices,Planting,,,,,,"Financial support
Training",Finance,,,Training,,,,"pests and diseases
prolonged drought",Pests,,Weather,Drought,,,,,undergo training,Training ,,,,,how to effectively grow coffee,long distances and transportation,Travel,,,provision of facilitation,Training materials,,,,,,,,favourable weather,,,,,,,,,we are not registered  and people dont pay,Shares,,
66,Zero grazing,Livestock,Zero grazing,,,,,,,If we can get training on how to prevent coffee diseases,Training,Pest management,,,,,,Pests and diseases,Pests,,,,,,,,none,None,,,,,the amount of space or distance that should be left between coffee trees,lack of enough knowledge,Lack of information/resources/demonstrations,,,provide facilitation,Training materials,,,,,,,,the price of coffee increased abit,,,,,,,,,if i fall to pay they consificate my properties.,Repayment Hard,,
67,how to make a nursery bed for coffee,Training,Good agricultural practices,Planting,,,,,,Getting training,Training,,,,,,,"Pests and diseases
climate changes
Thieves",Pests,,Weather,Changing,,Thieves,,,cutting off affected trees,Cut & Burn Affected Area,,,,,maintaining soil fertility,peoples' attitude,Poor Committment,,,provide trainings,Training,,,,,,,,i fell sick and didnt pay attention to the farm,,,,,,,,,people dont pay back in time,Repayment Hard,,
68,how to harvest coffee and practice mulching,Inputs,Compost,Mulching,Training,Harvesting,,,,If I can get financial support,Finance,,,,,,,It reduces on the production if you over prune,Crops,Low productivity,,,,,,,get training on how to handle them,Training ,,,,,how to make a work plan,long distances between farmers,Travel,,,carry out sensitizations,Sensitization,,,,,,,,long drought,,,,,,,,,they dont want to pay money in time,Repayment Hard,,
69,how to prevent pests,Training,Pest management,,,,,,,Always to have trainings and sensitising people,Training,,,,,,,"Pests and diseases
Some times drought",Pests,,Weather,Drought,,,,,cutting off affected coffee trees,Cut & Burn Affected Area,,,,,how to carryout mulching,"poor attendance or turn up by the farmers, farmers ask for material support",Poor Committment,,Lack of information/resources/demonstrations,not applicable,NA,,,,,,,,loss of fertility,,,,,,,,,I sell out my properties to pay back the loan.,Repayment Hard,,
70,value addition,Training,Value addition,,,,,,,If i can be given a loan and training,Training,,,Finance,,,,"Coffee diseases and pests
Price fluctuation",Pests,,Prices,Price fluctuation,,,,,practice mulching and cutting off affected plants,Soil mangement,Fertilizer,Mulching,Cut & Burn Affected Area,,improving the quality of coffee,having alot of family responsibility,Time,,,holding sensitization meetings,Sensitization,,,,,,,,the weather was abit favourable,,,,,,,,,Difficulties in backing back if i get poor harvest,Repayment Hard,Farming Challenges,
71,coffee farming,Training,Good agricultural practices,Coffee,,,,,,Training,Training,,,,,,,"Diseases and pests
Thieves",Pests,,Thieves,,,,,,picking out the affected trees and burning them.,Cut & Burn Affected Area,,,,,the importance of mulching,requesting fot material support by the farmers,Lack of information/resources/demonstrations,,,proper sharing of information with my family members,Share with family,,,,,,,,i lacked enough finances and pests affected coffee,,,,,,,,,high interest rates.,High Interest,,
72,effective coffee farming,Training,Good agricultural practices,Coffee,,,,,,Organisation should always increase or mantain the price of coffee,Prices,Better prices,,,,,,Coffee Pests and diseases,Pests,,,,,,,,cutting off the affectes trees,Cut & Burn Affected Area,,,,,bee keeping,long distances between the farmers,Travel,,,sensitizing farmers and encouraging them to create groups that could help them.,Sensitization,,"Work with a group, make a shared plan",,,,,,weather conditions,,,,,,,,,high interest rate if donnot pay in time,High Interest,,Repayment Hard
73,maintaining soil fertility,Training,Soil management ,,,,,,,If i can training on how best to prevent Coffee disease especially wealt.,Training,Pest management,,,,,,"Pests and duseases
Drought",Pests,,Weather,Drought,,,,,cut off and burn the affected coffee trees,Cut & Burn Affected Area,,,,,water management,conservertiveness about bee keeping and lack of enough space.,Different Opinions,,,transport facilitation,Funding to travel,,,,,,,,i carried out prunning,,,,,,,,,first give in money before youare given a loan,Delayed Disbursement,,
74,mulching and weeding coffe plantations,Inputs,Compost,Mulching,Training,Weeding,,,,Training about coffee diseases and pests.,Training,Pest management,,,,,,"pests and diseases
Inadequate manure",Pests,,Inputs,Fertilizer,Manure,,,,cut off affected trees,Cut & Burn Affected Area,,,,,how to prevent pests and diseases,long distances and lack of tools,Travel,,Lack of information/resources/demonstrations,sensitization about the importance of bee keeping.,Sensitization,,,,,,,,the plantation was affected by pests,,,,,,,,,,,,
75,harvesting coffee,Training,Harvesting,,,,,,,To always attend training,Training,,,,,,,Coffee disease and diseases,Pests,,,,,,,,cut and burn affected coffee trees,Cut & Burn Affected Area,,,,,Fellow Members of the society and cmmunity members,lack of facilitation,Lack of information/resources/demonstrations,,,facilitation and support,Training materials,,,,,,,,lack of mulching and composting,,,,,,,,,,,,
76,effective planting of coffee,Training,Good agricultural practices,,,,,,,Training us,Training,,,,,,,"Pests and diseases
Lack enough manure",Pests,,Inputs,Fertilizer,Manure,,,,cut off the affected trees,Cut & Burn Affected Area,,,,,Family Members,some farmers are conservertive,Different Opinions,,,Get some funds and sensitisation,Funding,,Sensitization ,,,,,,i had planted new coffee trees and also mulched,,,,,,,,,,,,
77,coffee growing,Training,Good agricultural practices,,,,,,,Training on the new methods of farming,Training,New ideas,,,,,,"Pests and diseases
Thieves",Pests,,Thieves,,,,,,cut off the affected coffee trees,Cut & Burn Affected Area,,,,,Fellow members and community members,"Transport costs.
Facilitation like allowances and food to provide during the  training",Travel,Per Diem,,May be to always make appointment with them,"Work with a group, make a shared plan",,,,,,,,Proper care of the plantations,,,,,,,,,,,,
