128,How to control pests and diseases in coffee and banana plantations.,Training,Pest management,,,,,,,getting loan from the society.,Finance,Farmer groups,,,,,,"waether changes ,coffee wilt",Weather,Changing,Pests,,,,,,"I cut and burn coffee plant that has wealt.
Consult extention workers",Cut & Burn Affected Area,,,Support ,Extension officers,EVERYTHING I HAVE LEARNT,failure to implement whay you train at your own farm,Fellow farmers do not accept training,,People lack necessities to implement new skills,start up demo site facilitate farmers to have ttainings at demo,Demonstration farm,,,,,,,,TRAINING RECEIVED AT THE CO-OPERATIVE SOCIETY,,,,,,,,,,,,
129,which pest and diseases spray should i use.,Training,Pest management,,,,,,,To hire aland.,Finance,Land,,Finance,Start-up capital,,,diseases and weather changes,Weather,Changing,Pests,,,,,,I cut the the coffee plant that has a disease.,Cut & Burn Affected Area,,,,,WOULD TEACH THEM ABOUT BUILDING COMPOST PITS,transport,Travel,,,consider perdiem,Per Diem,,,,,,,,PESTS AND DISEASES AFFECTING THE COFFEE TREES,,,,,,,,,,,,
130,modern farming,Training,Good agricultural practices,,,,,,,to train me and give capital,Training,,,Finance,,,,diseases and drought,Weather,Drought,Pests,,,,,,Always consult my fellow coffee farmers and extention workers,Support ,Extension officers,,Support ,Other farmers,WOULD SHARE THE IMPORTANCE OF PRUNNING AND ALSO ADVISE THEM NOT TO USE PESTCIDES IN ORDER TO PRODUCE ORGANIC HARVEST,most farmers do not know how to read and write,Poor Education,Literacy,,provide bicycles,Funding to travel,,,,,,,,GOOD FARMING PRACTICES LIKE BUILDING COMPOST PITS,,,,,,,,,,,,
131,how to plant better tea,Training,Good agricultural practices,,,,,,,financial support and training,Training,,,,,,,drought and diseases,Weather,Drought,Pests,,,,,,"I cut the affected coffee plants and burn them, then replant",Cut & Burn Affected Area,,,,,WOULD TEACH THEM TO PRACTICE MIXED FARMING,people lack interest,Poor Committment,,,provide visual aids for them to understand,Training materials,,,,,,,,INCREASE IN THE NUMBER OF TREES PLANTED,,,,,,,,,,,,
132,expertise in good farm managment,Training,Farm mangement,,,,,,,support from outside countries mostly  the women,Support,Women,,,,,,lack of information on bee keeping,Information,Bee keeping,,,,,,,I cut the coffee plant that has wealt and burn it .,Cut & Burn Affected Area,,,,,COFFEE SPACING DURING PLANTING,lack of interest,Poor Committment,,,providing them with sitting allowances,Per Diem,,,,,,,,INCREASED HARVESTS,,,,,,,,,,,,
133,how to do good managment and accounting and keeping records,Training,Farm mangement,,Record keeping,,,,,ready market for chicken and eggs,Market access,Poultry,,,,,,lack of enough space,Farm area,,,,,,,,I cut and uproot coffee plant that is affected,Cut & Burn Affected Area,,,,,PRUNNING,fear to keep bees by the farmer,Fear to keep bees,,,visual aids and mashroom seeds,Training materials,,,,,,,,COFFEE PESTS,,,,,,,,,,,,
134,How to pick tea,Training,Good agricultural practices,,,,,,,government should provide loans to farmers with low interest rate,Finance,Low interest loans,,,,,,drought,Weather,Drought,,,,,,,Consulting the extention workers,Training ,Extension officers,,,,DIGGING COMPOST PITS,lack of patience by the farmers,Poor Committment,,,more training,Training,,,,,,,,SOIL HAS BECOME INFERTILE,,,,,,,,,,,,
135,good agricultural praticed,Training,Good agricultural practices,,,,,,,getting support,Support,,,,,,,fear that bees are dangerous,Fear of bees,,,,,,,,I uproot and burn the plant that has a disease,Cut & Burn Affected Area,,,,,EARLY PLANTING,others give out wrong informations,Wrong Information,,,no challenges,NA,,,,,,,,GOOD WEATHER,,,,,,,,,,,,
136,On soil analysis majorly,Training,Soil management ,Soil quality analysis,,,,,,getting means of transport so that he can deliver his leaves personally,Transport,,,,,,,Alot of droght,Weather,Drought,,,,,,,I consult extention workers for advice,Support ,Extension officers,,,,WOULD TEACH THEM ON HOW TO CONTROL THE COFFEE WILT DISEASE THROUGH PRUNNING,others refuse to follow my advice,Fellow farmers do not accept training,,,training on bee keeping,Training,,,,,,,,"BAD WEATHER, HAILSTORMS",,,,,,,,,,,,
137,tea majorly,Training,Good agricultural practices,,,,,,,availability of finance aid,Finance,,,,,,,pest and diseases.,Pests,,,,,,,,I normally uproot and plant new types of coffee .,Cut & Burn Affected Area,,,,,WOULD TEACH WHATEVER I HAVE BEEN TAUGHT,some farmers lack interest,Poor Committment,,,training to train others,Training,,,,,,,,FAVOURABLE CLIMATE,,,,,,,,,,,,
138,How to manage coffee and banana plantations,Training,Good agricultural practices,Coffee,Training,Good agricultural practices,Banana,,,more training and finance,Training,,,Finance,,,,lack of labours and pests and diseases.,Pests,,Labour ,Shortage,,,,,EMPLOYING LABOUR TO HELP OUT AT THE FARM,Labour,Hire,,,,WOULD SHARE ABOUT HOW TO CONTROL THE COFFEE WILT DISEASE,lack of enough information,Lack of information/resources/demonstrations,,,provide visual aids,Training materials,,,,,,,,POOR CLIMATE LED TO REDUCTION IN COFFEE HARVESTED,,,,,,,,,,,,
139,training on modern farming,Training,Good agricultural practices,,,,,,,timely payment and advance,Payments,Timely,,Payments,Advances,,,pests and bad weather,Pests,,Weather,Poor,,,,,NONE,None,,,,,COFFEE SPACING,opposition from other farmers,Poor Committment,,,more moblization,Share benefits,,,,,,,,I GOT SUPPORT FROM CAFE DIRECT INFORM OF MULCHES,,,,,,,,,,,,
140,How to stop the spread of pests and diseases.,Training,Pest management,,,,,,,factory should help in providing manure to the farmers,Inputs,Fertilizer,Manure,,,,,lack of enough labour,Labour ,Shortage,,,,,,,USING PESTCIDES,Inputs,Pesticides,,,,"WOULD TEACH THEM TO PRUNE, MULCH AND WEED THEIR COFFEE PLANTATIONS",others give irrelevant information,Wrong Information,,,we should consult the extension workers,Increased support from cooperative,,,,,,,,"I GOT SICK, REDUCED MY FARMING ACTIVITY",,,,,,,,,,,,
141,what is the cause of price fractuation? How can i control pests and diseases,Training,Pest management,,Information,Prices,Price fluctuation,,,increase price of tea at mabale factory,Prices,Better prices,,,,,,lack of materials,Inputs,Materials,,,,,,,USING FERTILIZERS,Inputs,Fertilzers,,,,"WOULD TEACH THEM ABOUT PRUNNING, MULCHING",some dont use it so its a waste of time,Fellow farmers do not accept training,,,i can take them to the demonstration farm in order to get clear information,Demonstration farm,,,,,,,,COFFEE DISEASE,,,,,,,,,,,,
142,where can i get pest spray.,Inputs,Spraying,,,,,,,do it in phases so that he invests the money in the other thing,Finance,,,,,,,diseases and lack of enough capital,Pests,,Finance,Capital,,,,,UPROOTING AND BURNING THE AFFECTED COFFEE TREE,Cut & Burn Affected Area,,,,,UPROOTING AFFECTED PLANTS,they dont do what u have told them,Fellow farmers do not accept training,,,nothing,NA,,,,,,,,AVAILABILITY OF ENOUGH LAND TO PLANT,,,,,,,,,,,,
143,How to prunne coffee,Training,Pruning,,,,,,,not sure,,,,,,,,coffee diseases,Pests,,,,,,,,PRUNNING,Pruning ,,,,,"WOULD TEACH THEM ABOUT USING MANURE, MULCHING, PRUNNING",none,No Challenges,,,showing them using examples and demonstrations,Demonstration farm,,,,,,,,HAIL STORMS AFFECTED THE CROPS,,,,,,,,,,,,
144,Clear information on how to use artifical fertilizers.,Training,Pest management,,,,,,,more money to pay workers,Finance,Labour,,,,,,"drought,pest and diseases,lack of labours",Pests,,Weather,Drought,,Labour ,Shortage,,PRUNNING OFF AND BURNING THE AFFECTED BRANCH TO AVOID SPREAD OF DISEASE,Cut & Burn Affected Area,,,,,on how to make it and the benefits,not many,No Challenges,,,provide more training to me and also provide a senior trsiner to support me,Training,,Increased support from cooperative,,,,,,PESTS AND DISEASES,,,,,,,,,,,,
145,How to look after coffee and banana plantations with the aim of increasing productivity.,Training,Yield improvement,Coffee,Training,Yield improvement,Banana,,,provide more trees to farmers,Inputs,Trees,,Finance,,,,no challenge,None,,,,,,,,PLANTING IN TIME,Timely Planting,,,,,how to rare cattle and keep them healthy to increase productivity,people under mind you and dont take them up or even practice what you have shared with them.,Fellow farmers do not accept training,,,provide demonstrations so that people do not reject the information,Demonstration farm,,,,,,,,HARSH WEATHER CONDITIONS,,,,,,,,,,,,
146,how to pluck tea,Training,Plucking,,,,,,,provide more resources,Inputs,,,,,,,"pest and diseases, drought",Pests,,Weather,Drought,,,,,USING MANURE,Soil mangement,Fertilizer,Manure,,,with my local group,people dont seem to care about what is shared and others under mind the info given so its a waste of time,Fellow farmers do not accept training,,Poor Committment,being trained on specific area,Training,,,,,,,,INCREASE IN THE SEEDS PLANTED,,,,,,,,,,,,
147,Learn how to care for cows and soil maintainenance,Training,Livestock,Dairy,Training,Soil management ,,,,being trained and financing,Training,,,Finance,,,,prices majorly,Prices,,,,,,,,NONE YET,None,,,,,control of pests and erosion control,peoples level of understanding is low,Poor Understanding,,,By vistinf other farmers and having workshops.,Visit Fellow Farmers Farms,,,,,,,,LACK OF ENOUGH LABOUR,,,,,,,,,,,,
148,to be taught how to breed good goats and improve on the fish farming,Training,Livestock,Goats,Training,Livestock,Goats,,,provide with money,Finance,,,,,,,Not paying from the group and lack of fertilizer,Finance,Farmer groups not repaying,Inputs,Fertilizer,Limited,,,,PRUNNING OFF THE AFFECTED BRANCHES,Pruning ,,,,,making trenhes,some farmerd are slow in grapping ideas and others feel they know,Poor Understanding,,,through radios because its much easier,Radio,,,,,,,,PLANTING WELL SORTED SEEDS,,,,,,,,,,,,
149,to get farming skills and tea growing,Training,Good agricultural practices,,,,,,,if get transport can help me get manure to applyvin banana,Transport,,,Inputs,Fertilizer,Manure,,pests and diseases is so big,Pests,,Finance,Capital,,,,,BUYING MY OWN TOOLS AND BORROWING WHAT I DON'T HAVE FROM OTHER FARMERS,Inputs,Equpiment,,,,plunning,no problem or challenge,No Challenges,,,through radios,Radio,,,,,,,,GOT TRAINING ABOUT GOOD FARMING PRACTICES,,,,,,,,,,,,
150,Especially in disease control,Training,Pest management,,,,,,,if i get money and buy more land,Finance,Land,,,,,,pests and capital,Pests,,,,,,,,PRUNNING OFF AFFECTED PLANTS,Pruning ,,,,,gender and coffee,farmer is always busy working,Time,,,through radios like KRC radio,Radio,,,,,,,,PLANTED MORE CROPS,,,,,,,,,,,,
151,in tea producation and marketing,Training,Good agricultural practices,,Training,Marketing,,,,have materials to carry out that idea,Finance,New ideas,,,,,,"low capital to buy fertlizers, and price fluctuations of tea",Finance,Capital,Inputs,Fertilizer,Limited,Prices,Price fluctuation,,USING MULCHES AND PRUNNING TO IMPROVE UPON HARVESTS,Soil mangement,Fertilizer,Mulching,Pruning ,,training them on how to house chicken to avoid theives,others give out poor informations,Wrong Information,,,Have more extension farmers and also through radios,Radio,,Increased support from cooperative,,,,,,MY HARVESTS INCREASED,,,,,,,,,,,,
152,In live stock managment and growing fruits,Training,Livestock,,Training,Fruits,,,,,,,,,,,,lack of capital and labour,Labour ,Shortage,Finance,Capital,,,,,I ADD MULCHES IN THE GARDEN,Soil mangement,Fertilizer,Mulching,,,planting quality seedlings,farmers dony care,Poor Committment,,,through chutches and radios,Radio,,,,,,,,INCREASED HARVEST IN COFFEE,,,,,,,,,,,,
153,How can i  increase on my farm productivity.,Training,Yield improvement,,,,,,,,,,,,,,,lack of income and pests and lack of care,Income,Low,Pests,,,Lack of care,,,"PRUNNING OFF SICK BRANCHES
BURNING SICK PLANTS",Cut & Burn Affected Area,,,,,teaching them how to grow mashrooms,people have different minds to understand,Poor Understanding,,,through churches mainly,Church,,,,,,,,I CARRY OUT EARLY PLANTING,,,,,,,,,,,,
154,How to control pest and disease in coffee plantation,Training,Pest management,,,,,,,,,,,,,,,no big challenge,None,,,,,,,,PRUNNING OFF AFFECTED PLANT,Pruning ,,,,,share with them better farming methods,they donot take part,Poor Committment,,,to put in pratice and others copy,Visit Fellow Farmers Farms,,,,,,,,DROUGHT,,,,,,,,,,,,
155,How to control weeds in coffee plantation.,Training,Pest management,,,,,,,,,,,,,,,transport and poor road network,Transport,Poor roads,,,,,,,ATTENDED TRAINING WITH CAFE DIRECT AT THE UNION AND LEARNT ABOUT AMONG OTHER SOLUTIONS TO PRUNE OFF AFFECTED BRANCHES,Training ,CPF,,,,how to keep bees,people dont mind,No Challenges,,,through training,Training,,,,,,,,added more manure,,,,,,,,,,,,
156,HOw to make local nanures,Information,Compost,Manure,,,,,,,,,,,,,,lack of labour majorly,Labour ,Shortage,,,,,,,UPROOTING AFFECTED PLANTS,Cut & Burn Affected Area,,,,,more training on good agricultural practices,otheirs give wrong informations,Wrong Information,,,to pass through radios and churches,Radio,,Church,,,,,,too much drought,,,,,,,,,,,,
157,How to prevent the spread of pest and diseases in coffee,Training,Pest management,,,,,,,,,,,,,,,farmer lacks labour to work on the farm,Labour ,Shortage,,,,,,,"PRUNNING, UPROOTING AND BURNING AFFECTED PLANTS",Cut & Burn Affected Area,,,,,what i have been trained on,other farmers have no solutions to the problems,Lack of information/resources/demonstrations,,,i should be trained,Training,,,,,,,,more harvest after adding manure,,,,,,,,,,,,
158,How to prevent pest and diseases in my plantations.,Training,Pest management,,,,,,,,,,,,,,,"pest and diseased and price fractuation, drought.",Pests,,Prices,Price fluctuation,,,,,NOT YET,None,,,,,fruit growning,others they ignore my ideas,Fellow farmers do not accept training,,,through training majorly,Training,,,,,,,,"aplied manure,bought another plot",,,,,,,,,,,,
159,How to control coffee diseases.,Training,Pest management,,,,,,,,,,,,,,,"Lack of capital to improve my farm, drought",Finance,Capital,Weather,Drought,,,,,PRUNNING AFFECTED BRANCHES,Pruning ,,,,,how to use dry grasses during mulching this can reduce sunligt to hit the roots and stems hence increasing coffee productuon,others dont take my advice,Fellow farmers do not accept training,,,through trainig,Training,,,,,,,,he replanted,,,,,,,,,,,,
160,On modern farming,Training,Good agricultural practices,,,,,,,,,,,,,,,"pest and dideases, price fractuation,",Pests,,Prices,Price fluctuation,,,,,DRYING COFFEE BEANS ON ORDINARY CLOTHS UNDER THE SUN,Sun Drying,,,,,i adviced them to cut and burn all the infected coffee trees.,i dont get solutions to the problems.,Lack of information/resources/demonstrations,,,througj radios,Radio,,,,,,,,affected by hailstorm,,,,,,,,,,,,
161,in areas of growing tea,Training,Good agricultural practices,,,,,,,,,,,,,,,"Pests and diseases, price fractuation",Pests,,Prices,Price fluctuation,,,,,MULCHING AND PRUNNING,Soil mangement,Fertilizer,Mulching,Pruning ,,you should space coffee while planting and mulching.,lack of money to hold farmers meetings.,Costs,,,i should be trained in all sectors,Training,,,,,,,,gap filling wilt affected trees,,,,,,,,,,,,
162,How to look after or to increase coffee and banana production.,Training,Yield improvement,Coffee,Training,Yield improvement,Banana,,,,,,,,,,,"Limited land, pest and diseases, price fractuation",Pests,,Prices,Price fluctuation,,Farm area,,,I FARM WITH IN MY MEANS,Low cost farming,,,,,neighbours,i lack clear knowledge,Lack of information/resources/demonstrations,,,training,Training,,,,,,,,mulched and applied manure,,,,,,,,,,,,
163,"know more about his acreage,  how to improve on his quality",Training,Yield improvement,,Training,Quality,,,,,,,,,,,,pest and diseases,Pests,,,,,,,,"PRUNNING , UPROOTING AND BURNING AFFECTED PLANTS",Cut & Burn Affected Area,,,,,neighbouring farmers,some farmers are not fast at grapping,Poor Understanding,,,i can take them to my farm and  demonstrate to them.,Demonstration farm,,Visit Fellow Farmers Farms,,,,,,i malched my land,,,,,,,,,,,,
164,tour outside uganda to see how they practice their farming,Information,Farm demonstrations,,,,,,,,,,,,,,,"pest and diseases , price ftactuation, lack of manures.",Pests,,Inputs,Fertilizer,Manure,Prices,Price fluctuation,,"more manure,watering ,prunning",Soil mangement,Fertilizer,Manure,Pruning ,,fellow farmers in the community,they dont undestand fast,Poor Understanding,,,Extension workers should intervien in farmers problems.,Increased support from cooperative,,,,,,,,more attension even in drought,,,,,,,,,,,,
165,tea agronomic ptactices,Training,Good agricultural practices,,,,,,,,,,,,,,,"pest and diseases ,lack of funds, weather changes",Pests,,Finance,,,Weather,Changing,,uprooting the affected bananas,Cut & Burn Affected Area,,,,,share the knowlege recieved during training,farmer hasnt got any problem,No Challenges,,,the society should contribute money for the farmers meetings.,Increased support from cooperative,,Funding,,,,,,drought last year,,,,,,,,,,,,
166,information about more market,Information,Market,,,,,,,,,,,,,,,"pest and diseases,",Pests,,,,,,,,uproot the affected plants,Cut & Burn Affected Area,,,,,how to plant and harvest in time,ignorance,Lack of information/resources/demonstrations,,,i should be trained.,Training,,,,,,,,more efforts in developing the farm,,,,,,,,,,,,
167,teaching new methods of farming like mulching,Information,Compost,Mulching,,,,,,,,,,,,,,"pest and diseases , unstable prices",Pests,,Prices,Price fluctuation,,,,,"always reserve fund from sales to buy manure, field inspection",Finance,Reserve fund for purchases,,Field management,,taking farmers to my farm and we share ideas together.,majorly ignorance,Lack of information/resources/demonstrations,,,through radios mostly,Radio,,,,,,,,less drought,,,,,,,,,,,,
168,based agronomic practices gap,Training,Good agricultural practices,,,,,,,,,,,,,,,no major challenge,None,,,,,,,,mulching,Soil mangement,Fertilizer,Mulching,,,i share ideas with my friend on how to put dry grasses in the farm.,some people undermind us,Undermining,,,through through training,Training,,,,,,,,better practices like malching,,,,,,,,,,,,
169,we are a ware of what to do but price fluctuations,Information,Prices,Price fluctuation,,,,,,,,,,,,,,Expensive fertilizers,,,Input,Fertilizer,Costs,,,,promote tree planting,Tree planting,,,,,how to pluck tea and what i have learnt,"some community may not practice after training,  education and knowlegde gap",Education,Poor Understanding,Fellow farmers do not accept training,through sensitization and mobilisation,Sensitization,,,,,,,,similar practices,,,,,,,,,,,,
170,"take care of cattle, proper feeding of cow",Training,Livestock,Dairy,,,,,,,,,,,,,,"there is change in seasons, hailstones, lack of herbisides, lack of labour",Labour ,Shortage,Weather,Extreme,Hail,Input,Agrochemicals,,employ low wedge labour,Labour ,Low wages,,,,how to plant tea,"lack of transport, no lunch",Travel,Per Diem,,"facilitating them, transport refund",Funding to travel,,,,,,,,i provide them with maturep,,,,,,,,,,,,
171,as a tea grower he wants to know more a bout tae farming,Training,Good agricultural practices,,,,,,,,,,,,,,,lack of capital,Finance,Capital,,,,,,,continous planting,Replanting,,,,,how to plant properly,low turn up,Poor Committment,,,not sure,NA,,,,,,,,i covered my farm with dry grasses.,,,,,,,,,,,,
172,best practices in tea management,Training,Good agricultural practices,,,,,,,,,,,,,,,"lack of inputs, capital majorly",Input,,Finance,Capital,,,,,uprooting the affected plants,Cut & Burn Affected Area,,,,,good information,"transport to the meeting place, need of lunch and stationary",Travel,Per Diem,,mobilising more farmers,Share benefits,,,,,,,,Drought and heavy rain,,,,,,,,,,,,
173,teach him new methods of farming to improve yields,Training,Yield improvement,,,,,,,,,,,,,,,High costs of inputs and poor market and weather,Weather,,Inputs,Fertilizer,Costs,Markets,,,no solution,None,,,,,how to pluck tea and Irrigation,not sure,No Challenges,,,if could reduce the number of farmers and meet few groups,"Work with a group, make a shared plan",,,,,,,,diseases and weather changes,,,,,,,,,,,,
174,get information incase the price of tea is increased,Information,Prices,Price fluctuation,,,,,,,,,,,,,,prices and inputs,Prices,,Inputs,,,,,,uprooting the affected stems,Cut & Burn Affected Area,,,,,for example how to mulching and changing crop if there is failure,"transport, facilitation inform of lunch",Travel,Per Diem,,door to door training,Visit Fellow Farmers Farms,,,,,,,,there were many diseases last year,,,,,,,,,,,,
175,on how to apply inputs,Training,Input management,,,,,,,,,,,,,,,"expensive inputs, pests , and weather mostly",Weather,,Inputs,Fertilizer,Costs,,,,no solutions,None,,,,,depending on what the farmer has learnt,farmers are not interested,Poor Committment,,,provide with means of transport as a motorcycle since they are hard to reach areas,Funding to travel,,,,,,,,better weather,,,,,,,,,,,,
176,good farming practices,Training,Good agricultural practices,,,,,,,,,,,,,,,mostly prices of tea,Prices,,,,,,,,uprooting the affected  plants,Cut & Burn Affected Area,,,,,good farming practice what i have learnt,low interest with farmers,Poor Committment,,,sensitising farmers,Sensitization,,,,,,,,paying more attension to the farm,,,,,,,,,,,,
177,tree planting,Training,Trees,,,,,,,,,,,,,,,prices and lack of labour,Prices,,Labour ,Shortage,,,,,uprooting the affected plant,Cut & Burn Affected Area,,,,,what the farmer has learnt,may be might ask him questions his not ready to answer or doesnot have any idea a bout,Lack of information/resources/demonstrations,,,sensitizing farmers,Sensitization,,,,,,,,manuring and malching,,,,,,,,,,,,
178,more teachings on how to pluck tea,Training,Plucking,,,,,,,,,,,,,,,prices that are unstable,Prices,Price fluctuation,,,,,,,by mulching,,,,,,Any good farm pratice that i know or learnt,sometimes its hard to share the idea,Communication,,,through seminars,Training,,,,,,,,affected by drought,,,,,,,,,,,,
179,padocks on the farm,Livestock,,,,,,,,,,,,,,,,"Thieves, unstable price, lack of capital.",Prices,Price fluctuation,Finance,Capital,,Thieves,,,i cut and burn the infected the infected coffee trees.,Cut & Burn Affected Area,,,,,share ideas on how to use modern farming,"transport costs, materials",Travel,Costs,Lack of information/resources/demonstrations,group of few people,"Work with a group, make a shared plan",,,,,,,,because of pest and diseases,,,,,,,,,,,,
180,more knowledge on tea,Information,Good agricultural practices,,,,,,,,,,,,,,,"pest and diseases, weeds, price fractuation.",Pests,,Weeds,,,Prices,Price fluctuation,,i work with my wife and i should cut and burn infected  crops,Cut & Burn Affected Area,,,Work with wife,,like planting in seasons,some of them will not accept good plucking leaves,,,,provide with transport and materials,Funding to travel,,,,,,,,Because of drought,,,,,,,,,,,,
181,how to control pests and diseases,Training,Pest management,,,,,,,,,,,,,,,"Am very old so i cant manage my farm, pest and diseases,lack of money to hire labours and thieves.",Pests,,Age,,,Labour ,Shortage,Thieves,nothing yet,None,,,,,what i know,not interested,Poor Committment,,,increase price of the leaf,Per Diem,,,,,,,,Because of price fluctuations of tea,,,,,,,,,,,,
182,technical staff should teach them how to apply fertilizers,Training,Input management,,,,,,,,,,,,,,,"pest and disease, lack of gunboats",Pests,,,,,,,,employing cheap labour,Labour ,Low wages,,,,any good farming practice,they those that are not easy learners,Poor Understanding,,,with those interested,Committed Farmers,,,,,,,,Because of fertilizers,,,,,,,,,,,,
183,record keeping to know how am spending my money,Record Keeping,,,,,,,,,,,,,,,,"i have eye defect so i cannot manage my farm, poor soils, pest and diseases, lack of money.",Illness,,Soil mangement,Fertility,,Pests,,Finance,dry the coffee in bits,Sun Drying,,,,,what i have learnt,as villagers they expect alot from you apart from knowledge,High expectations of training,,,repeat several times for those who didnot understand,Training,,,,,,,,Because of price fluctuations,,,,,,,,,,,,
184,teach new methods of farming,Information,Good agricultural practices,,,,,,,,,,,,,,,pest and diseases and lack of matures.,,,,,,,,,uprooting and burning the affected coffee trees,Cut & Burn Affected Area,,,,,"If you  prun, mulch and plant in time you can get high yield.",expect transport refund,Per Diem,,,hold a village meeting including stake holders,Village meeting,,,,,,,,Because i have a worker,,,,,,,,,,,,
185,,,,,,,,,,,,,,,,,,"pest and diseases, price fractuation, limited knowledge on farming.",Pests,,Prices,Price fluctuation,,Knowledge,,,planting in time.,Timely planting,,,,,that if our coffee plantations get pest and diseases we should consult the extension wokers.,lack of what to use,Lack of information/resources/demonstrations,,,provide with transport means,Funding to travel,,,,,,,,According to increased producation,,,,,,,,,,,,
186,,,,,,,,,,,,,,,,,,"pest and diseases, drought, lack of hoes.",Pests,,Weather,Drought,,Inputs,Equpiment,,To mulch the farm and cut the infected coffee treeses,Soil mangement,Fertilizer,Mulching,Cut & Burn Affected Area,,i encourage them to encouge in agriculture,many farmers are not educated,Poor Education,,,provide with materials we can use,Training materials,,,,,,,,There is no money for in puts,,,,,,,,,,,,
187,,,,,,,,,,,,,,,,,,"pest and diseases, price fractaution, lack of manures.",Pests,,Inputs,Fertilizer,Manure,Prices,Price fluctuation,,to change the farming system,Farm management,Change the system,,,,i advice them to cut the affected coffee tree.,transportation cost,Travel,Costs,,sensitize,Sensitization,,,,,,,,because of too much sun  and lack of labour,,,,,,,,,,,,
