78,improving the quality of coffee and bananas,Training,Good agricultural practices,Quality,,,,,,I cut and uproot the coffee plant that has wealt,Training,Pest management,,,,,,"Pests and diseases
Thieves who normally steak my coffee from the plantation",Pests,,Thieves,,,,,,cut off affectes trees,Cut & Burn Affected Area,,,,,My Friends,Time since since most of my friends are very far and busy,Time,,Travel,I can form a group for coffee growers,"Work with a group, make a shared plan",,,,,,,,favourable weather conditions,,,,,,,,,,,,
79,better coffee farming practices,Training,Good agricultural practices,,,,,,,Traininin is highly needed.,Training,,,,,,,"Coffee diseases
Weed",Pests,,Weeds,,,,,,cutting and burning affected coffee trees,Cut & Burn Affected Area,,,,,My close friend,"Low attendance
Limited time 
People need allowances to attend a discussion or training",Time,,Poor Committment,To get more support from the coffee orgasations,Increased support from cooperative,,,,,,,,i didnt do anything different,,,,,,,,,,,,
80,bee keeping,Training,Bee keeping,,,,,,,GETTING FINANCIAL HELP,Finance,,,,,,,"Coffee diseases
Pests
At times snow",Pests,,Extreme,Snow,,,,,cutting off and burning affected trees,Cut & Burn Affected Area,,,,,Better methods of farming,No challenge because she is my neighbour,No Challenges,,,To first get training,Training,,,,,,,,favourable,,,,,,,,,,,,
81,how to grow good quality coffee,Training,Good agricultural practices,Quality,,,,,,GETTING TAUGHT ON HOW TO CONTROL THE COFFEE WILT DISEASE,Training,Pest management,,,,,,"pests and diseases
Drought
Thieves",Pests,,Weather,Drought,,Thieves,,,cutting affected trees and burning them,Cut & Burn Affected Area,,,,,"My exprience in coffee production
Information I will have acquired from the training",Low turn up of people because people need sitting allowances,Per Diem,,,If i can get some facilitation to motivate people to attend the trainings,Training materials,,,,,,,,not maintaining soil fertility,,,,,,,,,,,,
82,maintaing soil fertility,Training,Soil management ,,,,,,,GETTING MORE HELP FROM THE CO-OPERATIVE SOCIETY,Support,,,,,,,"Inadequete money to buy manure and pestcides.
Price fluctuation.
Low price",Prices,Price fluctuation,Inputs,Fertilizer,Manure,Prices,Low prices,,cutting off the affected trees and burning them,Cut & Burn Affected Area,,,,,Best coffee practices,No big challenge,No Challenges,,,Provide training nearer to the farmers,Training,Proximity to farmers,,,,,,,pests and diseases on the farm,,,,,,,,,,,,
83,water management,Training,Water management ,,,,,,,BE GIVEN ACCESS TO LOANS TO HELP FINANCE AND BUY FARM INPUTS AND TOOLS,Finance,Inputs,,Finance,Equipment,,,"Pests and diseases
I lack manure",Pests,,Inputs,Fertilizer,Manure,,,,cut off the affected plants,Cut & Burn Affected Area,,,,,How to control coffee pests and diseases,Low turn up,Poor Committment,,,"If there is some one from coffee organisations to go with.
Facilitation",Increased support from cooperative,,,,,,,,incresead number of coffee trees,,,,,,,,,,,,
84,how to improve on the quality of coffee,Training,Good agricultural practices,Quality,,,,,,EASIER ACCESS TO FINANCES,Finance,,,,,,,"Coffee wealt.
Price fluctustion
Coffee thieves",Pests,,Prices,Price fluctuation,,Thieves,,,cutting off the affected coffee trees,Cut & Burn Affected Area,,,,,Modern farming practices,Lack of money to implement what we normally learn,People lack necessities to implement new skills,,,Need some facilitation and training,Training materials,,,,,,,,i practiced mulching,,,,,,,,,,,,
85,how to prevent pests and diseases,Training,Pest management,,,,,,,BE GIVEN GOOD SEEDLINGS,Inputs,Seedlings,,,,,,"Coffee wealt
Price flutuation",Pests,,Prices,Price fluctuation,,,,,cut off the affected plantations,Cut & Burn Affected Area,,,,,Best farming practices,"Low turn up 
In adequate time",Poor Committment,,,If I am trained,Training materials,,Training,,,,,,unfavourable weather conditions,,,,,,,,,,,,
86,maintaining quality,Training,Good agricultural practices,Quality,,,,,,AVAILABILITY OF FINANCES OR LOANS,Finance,,,,,,,"Pests and diseases
Coffee wealt",Pests,,Prices,Price fluctuation,,,,,cutting off affected plantations,Cut & Burn Affected Area,,,,,coffee plantation practices,Inadequate information,Lack of information/resources/demonstrations,,,Attending trainings,Training,,,,,,,,i added value to the farm by mulching,,,,,,,,,,,,
87,Solutions to coffee diseases and pests,Training,Good agricultural practices,,,,,,,INCREASE IN FINANCING,Finance,,,,,,,"Pests and diseases
I fail to get money to buy manure
Again am always busy doing other things other than coffee",Pests,,Inputs,Fertilizer,Manure,Time,,,cutting off affected plants,Cut & Burn Affected Area,,,,,Prevention of coffee disease,"Inadequete knowledge on coffee farming.
Time since most of them are busy",Lack of information/resources/demonstrations,,,Provide training,Training,,,,,,,,Weather was abit favourable,,,,,,,,,,,,
88,Information about the causes of price flutuation,Information,Prices,Price fluctuation,,,,,,TRAINING IN MANURE MAKING,Training,Soil mangement,Manure,,,,,Coffee wealt.,Pests,,,,,,,,cut and burn the affected plantations,Cut & Burn Affected Area,,,,,benefits of prunning coffee,"Low turn up
Facilitation fee
 Lack of training materials",Lack of information/resources/demonstrations,Poor Committment,Per Diem,Need financial support and training materials,Per Diem,,Training materials,,,,,,pests and diseases affected the plantations,,,,,,,,,,,,
89,"Best farming Practices
Trainings
Prices of coffee
visting demonstrations from other farmers",Training,Good agricultural practices,,Information,Prices,,Training,Farm demonstrations,information on how yo keep bees,Information,Bee keeping,,,,,,Pests and diaeases,Pests,,,,,,,,cut and burn the affected plants,Cut & Burn Affected Area,,,,,How best they can ensure quality of coffee,Low turn up of people,Poor Committment,,,Need motivation and to be sensitised,Sensitization,,Motivation,,,,,,It because of coffee pests,,,,,,,,,,,,
90,On coffee diseases and pests,Training,Pest management,,,,,,,more information and financial support,Information,,,Finance,,,,Coffee pests and disease.,Pests,,,,,,,,cut off and burn affected plants,Cut & Burn Affected Area,,,,,How to prevent coffee diseases and pests,"Inadequate knowledge on the subject.
Others demand for money",Lack of information/resources/demonstrations,Per Diem,,We should have training and there is a need for sensitisation,Training,,Sensitization,,,,,,Good methods of farming,,,,,,,,,,,,
91,Ho we can control coffee diseases and pests,Training,Pest management,,,,,,,start up capital,Finance,Start-up capital,,,,,,"Pests and diseases
Low coffee prices
Coffee wealt.",Pests,,Prices,Low prices,,,,,cutting and burning the affected plants,Cut & Burn Affected Area,,,,,Best coffee practices and best ways of ensuring qyality of coffee,Inadequate training,Lack of information/resources/demonstrations,,,Need training for the farmers,Training,,,,,,,,It was affected by snow during flowering,,,,,,,,,,,,
92,Coffee prices,Information,Prices,,,,,,,government suport,Government access,,,,,,,"Coffee diseases and pests
I donot have energy to make trenches since I am old.",Pests,,Age,,,,,,cutting off and burning affected plantations.,Cut & Burn Affected Area,,,,,How to control coffee diseases and pests,"At times lack of transport the farmers
Lack of training materials",Travel,,Lack of information/resources/demonstrations,"Advising my fellow farmers to always attend trainings
The organisation to provide us training materials",Increased support from cooperative,,Training materials,,,,,,we got new types of coffee that are resistant,,,,,,,,,,,,
93,Information about modern coffee practices,Information,Good agricultural practices,,,,,,,demos,Training,Farm demonstrations,,,,,,"Coffee diseases and pests
In adequate money to buy mulches",Pests,,Inputs,Fertilizer,Mulching,,,,cutting off affected plants.,Cut & Burn Affected Area,,,,,"Coffee diseases
How to ensure quality of coffee",In sdequate informstion about coffee diseases and pests,Lack of information/resources/demonstrations,,,If I can be trained and given training materials,Training,,Training materials,,,,,,Good weather,,,,,,,,,,,,
94,Best coffee practices,Training,Good agricultural practices,,,,,,,training on it,Training,,,,,,,Pests and diseases especially coffee wealt,Pests,,,,,,,,cut off affected plants and burn them,Cut & Burn Affected Area,,,,,Coffee disease and pests,I might fail to get time to share information with others since I am always busy,Time,,,Senstising coffee farmers,Sensitization,,,,,,,,Favourable weather,,,,,,,,,,,,
95,Coffee diseases and pests,Training,Pest management,,,,,,,maximise coffee produce to get money that can enable him buy much more land,Training,Yield improvement,,,,,,"Pests and diseases
Low prices 
Coffee wealt",Pests,,Prices,Low prices,,,,,no solutions per now,None,,,,,How to prevent the spread of coffee diseases and pests,They normally technical questions which require expertise,Prefer training from experts/extension staff,,,May be to fix some time on my schedule,Coordination,,,,,,,,Good weather and addition of manure,,,,,,,,,,,,
96,About good coffee practices,Training,Good agricultural practices,,,,,,,training on chicken housing,Training,Livestock,Poultry,,,,,"Coffee diseases and pests.
Price price fluctuation",Pests,,Prices,Price fluctuation,,,,,I always consult extention workers,Support ,Extension officers,,,,How best we can ensure quality of coffee,"Indequete funds to facilitate training.
Lack kf training materials",Lack of information/resources/demonstrations,Per Diem,,Training atleast once in two months,Training,,,,,,,,Good farming practices,,,,,,,,,,,,
97,Best and modern farming practices,Training,Good agricultural practices,,,,,,,more trainibg on how to make cheap but good quality manure,Training,Soil mangement,Manure,,,,,Pests and diseases especially coffee wealt.,Pests,,,,,,,,"I normally buy pestcides
Normally consult farmer promoters for guidance",Support ,Farmer promoters,,Inputs,Pesticides,Mantaining the quality of coffee,People can refuse to come which leads to low turnup,Poor Committment,,,To always attend trainings and acquire training materials,Training,,,,,,,,Best practices,,,,,,,,,,,,
98,Advice on how to properly grow coffee and ensure coffee quality,Training,Good agricultural practices,Quality,,,,,,training on these ideas,Training,,,,,,,"Pests and diseases
Lack of casual workers to help in my plantation.
Price fluctuation.",Pests,,Labour ,Shortage,,Prices,Price fluctuation,,"Always attent trainings
Seeking guidance and advice from the professionals
Reporting thefty Cases to police",Support ,Farmer promoters,,Training ,,Any information I will have learnt,People demand for allowances,Per Diem,,,Sensitising,Sensitization,,,,,,,,Good Weather,,,,,,,,,,,,
99,Information about coffee management.,Training,Good agricultural practices,,,,,,,getting credit facilities like loans at a low interest,Finance,Low interest loans,,,,,,"PESTS AND DISEASES, WEEDS, FINANCES AND LABOUR",Pests,,Weeds,,,Labour ,,Finance,I consult the extention workers,Support ,Extension officers,,,,How to control coffee disease and pest,Low turn up.,Poor Committment,,,"If We can senstise people about the importance of training, they can attend the sessions.",Sensitization,,,,,,,,Best farming practices,,,,,,,,,,,,
100,Coffee farming and Production,Training,Good agricultural practices,,,,,,,provision of loans,Finance,,,,,,,POOR CLIMATE UNFAVOURABLE FOR TOMATO GROWING,Weater,Poor,,,,,,,We prune the affected ones,Cut & Burn Affected Area,,,,,"How to mantain coffee quality and increase productivity
Importance of planting coffee",People normally attend the training but they refuse to implement,People lack necessities to implement new skills,,,I can always advice themp,Training,,,,,,,,Lack of manure and coffee disease,,,,,,,,,,,,
101,How to control coffee wealt,Training,Pest management,,,,,,,financial support,Finance,,,,,,,PESTS AND DISEASES,Pests,,,,,,,,"Consulting extentiom workers
Spraying it",Support ,Extension officers,,Spraying,,How to manage coffee from time of planting up to production and selling.,People have different attitudes and beliefs,Different Opinions,,,To always senstise people about the importance of good coffee management.,Sensitization,,,,,,,,Favourable conditioms,,,,,,,,,,,,
102,Causes of price fluctuation,Information,Prices,Price fluctuation,,,,,,training on growing fruits,Training,Fruits,,,,,,"PESTS AND DISEASES
COFFEE WILT DISEASE",Pests,,,,,,,,Extention workers helped us on how we can control coffee related pests and diseases,Support ,Extension officers,,,,How to control coffee pests and diseases.,No big challenge as long as am trai ed.,No Challenges,,,Always train people and sensitise them on time.,Training,,Sensitization,,,,,,Favourable conditions,,,,,,,,,,,,
103,Improved methods of coffee farming,Training,Good agricultural practices,,,,,,,Getting advice from extension workers.,Training,Extension officer,,,,,,COFFEE PESTS AND DISEASES,Pests,,,,,,,,Spraying with chemicals,Spraying,,,,,How best they can control coffee disease and pests.,At times some people can deliberately refuse to attend and listen.,Poor Committment,,,To always attend trainings,Training,,,,,,,,I added manure and best practices,,,,,,,,,,,,
104,New i deas on how to plant modern types of coffee,Training,New ideas,,Inputs,Modern varieties,,,,more training on goat raring,Livestock,Goats,,,,,,#NAME?,,,,,,,,,Consulting extention workers,Support ,Extension officers,,,,Coffee disease and prevention,Some people refuse to come thus low turn up.,Poor Committment,,,Always sensitise people about the benefits of trainings,Sensitization,,,,,,,,It was affected by snow,,,,,,,,,,,,
105,Modern Coffee practices.,Training,Good agricultural practices,,,,,,,if i was given training,Training,,,,,,,COFFEE WILT DISEASE,Pests,,,,,,,,"Spraying , cut the affected one and the replant",Cut & Burn Affected Area,,,Spraying,,How to plant and harvest good quality coffee,People normally come in small numbers and donot implement what they are trained.,Poor Committment,,People lack necessities to implement new skills,"To inform them earier before the training.
To always invite other experts to conduct or facilitate the training.",Coordination,,Experts,,,,,,Coffee disease affected it,,,,,,,,,,,,
106,Causes of coffee diseases,Training,Pest management,,,,,,,more loans and advances to add on my capital,Finance,,,,,,,CO-OPERATIVE SOCIETY NOT HELPING MUCH WITH GIVING US TOOLS,Lack of support ,,,,,,,,Getting advice from extention Workers,Support ,Extension officers,,,,How best we can prevent coffee diseases.,"People have different attitudes and beliefs.
Some people donot implement what they are trained",fellow farmers do not accept training,,People lack necessities to implement new skills,Always senstise people,Sensitization,,,,,,,,I added manure in my coffee plantation,,,,,,,,,,,,
107,MODERN FARMING PRACTICES,Training,Good agricultural practices,,,,,,,sharing ideas with other farmers,Information,New ideas,,Information,Sharing with other farmers,,,"COFFEE PESTS 
FINANCIAL CONSTRAINTS
INADQUATE LABOUR",Pests,,Finance,,,Labour ,Shortage,,"Normally cut and burn the infected coffee plants
Seeking advice from extension workers",Support ,Extension officers,,Cut & Burn Affected Area,,How intergrate new types of coffee with the old type.,No big challenge.,No Challenges,,,To always give clear guidance and advice.,Training materials,,,,,,,,Drought during flowering,,,,,,,,,,,,
108,USING PESTCIDES INORDER TO CURB PESTS AND DISEASES,Training,Pest management,,,,,,,sharing with friends,Information,Sharing with other farmers,,,,,,PESTS,Pests,,,,,,,,Cut the coffee plant that is affected by the disease,Cut & Burn Affected Area,,,,,Importance if quality coffee,Some people donot follow the guidelines.,Different Opinions,,,To have as many trainings as possible and to always monitor the progress.,Training,,,,,,,,its because my coffee was still young,,,,,,,,,,,,
109,WOULD LIKE TO BE TRAINED ON HOW TO MANAGE AND CONTROL THE COFFEE WILT DISEASE,Training,Pest management,,,,,,,if i get money i will hire labours on my farm.,Finance,Labour,,,,,,"LACK OF FERTILIZERS
PESTS",Pests,,Inputs,Fertilizer,Limited,,,,Cut the affected coffee plants,Cut & Burn Affected Area,,,,,Prevention of coffee diseases,Most people are not interested to implement,Fellow farmers do not accept training,,,"Raising awareness 
Provide insentives to whoever attends like free hoes",Sensitization,,Per Diem,,,,,,I didnot concentrate on coffee,,,,,,,,,,,,
110,"POULTRY FARMING, PIG FARMING, VISITING DEMONSTRATION FARMS",Training,Farm demonstrations,,Livestock,Poultry,,Livestock,Pigs,training majorly,Training,,,,,,,COFFEE PESTS,Pests,,Inputs,Fertilizer,Manure,,,,I always consult the extension workers,Support ,Extension officers,,,,How best to we can prevent coffee diseases and pestd.,"Inadequate time to share with others.
Distance  since it needs some facilitation.",Time,,Travel,"I can reshedule my time table
Get some facilitation",Coordination,,Training materials,,,,,,climatic changes,,,,,,,,,,,,
111,#NAME?,,,,,,,,,Given capital,Finance,Start-up capital,,,,,,"PESTS AND DISEASES
LACK OF MANURE AND FERTILIZERS",Pests,,,,,,,,I always consult extention workers from the society,Support ,Extension officers,,,,I WOULD SHARE WHATEVER KNOWLEDGE I'VE BEEN TAUGHT FOR EXAMPLE MULCHING TO MANAGE SOIL EROSION,Low turnup and lack of interest to some farmers,Poor Committment,,,Need of intensive training,Training,,,,,,,,Favourable weather conditions,,,,,,,,,,,,
112,cattle rareing,Livestock,Cattle,,,,,,,to have money and training on how to do it,Finance,,,Training,,,,"COFFEE PESTS
DRYING OF COFFEE BRANCHES AND LEAVES",Pests,,,,,,,,"we normally cut old plantation
Again we burn the affected coffee stems",Cut & Burn Affected Area,,,,,I WOULD SHARE WHATEVER I'VE LEARNT,#NAME?,-1,,,Extention workers can help in sensitising prople.,Increased support from cooperative,,Sensitization,,,,,,I ncreased manure and efforts,,,,,,,,,,,,
113,"how to treat cattle to produce more milk.
also more exposure visits",Livestock,Cattle,,Training,Farm demonstrations,,,,By funding,Finance,,,,,,,"BANANA BACTERIAL WILT DISEASE, COFFEE WILT DISEASE, THIEVES, LACK OF TARPAULINS TO DRY COFFEE SEEDS",Pests,,Inputs,Equpiment,Drying equipment,Thieves,,,I normally share the challenge with my friends and extention workers,Support ,Extension officers,,Support ,Other farmers,WOULD TEACH THEM WHATEVER I HAVE BEEN TAUGHT,NONE,No Challenges,,,BE GIVEN FARMING TOOLS,Training materials,,,,,,,,coffee disease,,,,,,,,,,,,
114,soil fertility improvement,Training,Soil management,,,,,,,lf given capital,Finance,Start-up capital,,,,,,LACK OF LABOUR TO WORK ON MY FARM,Labour ,Shortage,,,,,,,"I normally report to police
Cut the affected coffer plant and replant",Cut & Burn Affected Area,,,Replant,,WHATEVER I HAVE BEEN TAUGHT,FINANCIAL CONSTRAINTS,Costs,,,GET FUNDING THROUGH CO-OPERATIVE SOCIETIES,Increased support from cooperative,,Funding,,,,,,we use modern farming,,,,,,,,,,,,
115,how to maintain a poultry project,Livestock,Poultry,,,,,,,if i could be suported by loan it would be easy,Finance,,,,,,,COFFEE AND BANANA WILT DISEASE,Pests,,,,,,,,"At times i spray
I also normally weed in time",Farm management,Weed control,,Spraying,,"BURNING AFFECTED COFFEE TREES
PRUNNING
MULCHING
DIGGING TRENCHES TO PREVENT SOIL EROSION",ABSENTISM OF SOME FARMERS DURING CO-OPERATIVE MEETINGS,Poor Committment,,,MEET OFTEN AT THE CO-OPERATIVE SOCIETY,Meet at cooperative society,,,,,,,,Coffee wealt,,,,,,,,,,,,
116,more training on quality seedlings and more training on soil management,Training,Soil management,,Inputs,Seedlings,,,,getting trained on how to secure loans,Training,Securing loans,,,,,,"PESTS AND DISEASES
HAILSTORMS DURING HEAVY RAINS",Pests,,Weather,Extreme,Hail,,,,I normally consult my fellow farmers and extention farmers,Support ,Extension officers,,Support ,Other farmers,I WOULD ENCOURAGE THEM TO JOIN THE CO-OPERATIVE SOCIETY SO THAT THEY BECOME MORE KNOWLEDGABLE,NONE YET,No Challenges,,,IMPROVING UPON COMMUNICATION SKILLS AND METHODS FOR EXAMPLE CALLING THOSE WITH PHONES,Coordination,,,,,,,,Addution of manure in my coffee plantation,,,,,,,,,,,,
117,more training on how to get good but cheap manure,Training,Soil management ,Compost,,,,,,being trained,Training,,,,,,,"PESTS AND DISEASES
LACK OF CAPITAL LOANS TO IMPROVE FARMING
LACK OF MONEY TO BUY GARDENING TOOLS",Pests,,Finance,Equipment,,,,,I cut snd burn coffee disease that has a disease,Cut & Burn Affected Area,,,,,WOULD SHARE WITH THEM ON HOW TO CONSTRUCT COMPOST PITS TO DEPOSIT IN WASTE THAT WOULD LATER BE USED AS MANURE,SOME FARMERS DONT APPLY THE KNOWLEDGE GIVEN TO THEM INTO PRACTICE DUE TO LACK OF FINANCES,People lack necessities to implement new skills,,,ENCOURAGE CO-OPERATIVE SOCIETIES TO GIVE ADVANCE LOANS TO FARMERS,Increased support from cooperative,,Loans,,,,,,Favourable climate,,,,,,,,,,,,
118,"growing mushrooms and adding value to matooke, for example banana chips",Training,Mushrooms,,Training,Value addition,,,,To get aloan from the society,Finance,Farmer groups,,,,,,"I HAVE NO LABOUR TO HELP OUT ON MY FARM. 
AM TOO OLD.",Labour ,Shortage,Age,,,,,,"Always comitted to the contract signed and supply coffee to the society.
Always for advice from the extention workers.",Support ,Extension officers,,Finance,Deliver on contract,BEE KEEPING,ABSENCE OF SOME FARMERS DURING CO-OPERATIVE MEETINGS,Poor Committment,,,NONE YET,NA,,,,,,,,HARSH CLIMATIC CONDITIONS. TOO MUCH SUNSHINE.,,,,,,,,,,,,
119,more training on disease prevention,Training,Pest management,,,,,,,"by getting loans through crop finance,",Finance,,,,,,,"LACK OF GRASS TO USE FOR MULCHING
PESTS AND DISEASES",Pests,,Inputs,Fertilizer,Mulching,,,,"Cut the affected coffee plant and burn them.
A gain I consult extention workers",Cut & Burn Affected Area,,,Support ,Extension officers,WOULD SHARE EVERYTHING I HAVE BEEN TAUGHT,THE CO-OPERATIVE SOCIETY HAS A DISORGANISED       ADMINISTRATION AND TAKES AGES TO PAY FARMERS AFTER SUPPLYING THEM WITH COFFEE,Cooperative Level Challanges,,,IMPROVEMENT OR CHANGE IN CO-OPERATIVE SOCIETY ADMINISTRATION,Increased support from cooperative,,,,,,,,PESTS,,,,,,,,,,,,
120,how to dry coffee,Training,Coffee drying,,,,,,,if some one help me with money then i will solve my problem.,Finance,,,,,,,LACK OF LOAN SCHEMES TO IMPROVE OUR FARMING,Finance,,,,,,,,I Cut the coffee plant that has wealt then burn it,Cut & Burn Affected Area,,,,,BUILDING TRENCHES TO STOP RAIN WATER FROM ERODING SOIL,REDUCTION IN THE FREQUENCY OF FARMER TRAINING MEETINGS AT THE CO-OPERATIVE SOCIETY,Cooperative Level Challanges,,,#NAME?,NA,,,,,,,,GOOD FARMING PRACTICES,,,,,,,,,,,,
121,growing and keeping fruits healthy,Training,Fruits,,,,,,,getting loans from society,Finance,Farmer groups,,,,,,"pests, diseases,and weather changes",Pests,,Weather,Changing,,,,,I normally consult extention workers,Support ,Extension officers,,,,WOULD TEACH THEM THE ADVANTAGES OF EARLY PLANTING,SOME FARMERS DO NOT PUT INTO PRACTICE WHAT THEY HAVE BEEN TAUGHT,People lack necessities to implement new skills,,,INCREASE IN THE FREQUENCY OF FARMER TRAINING MEETINGS,Training,,,,,,,,THE WEATHER HAS BEEN FAVOURABLE,,,,,,,,,,,,
122,growing fruits,Training,Fruits,,,,,,,funding,Finance,,,,,,,banana wilt,Pests,,,,,,,,"Cut and burn the affected coffee plant.
Prune and replant",Cut & Burn Affected Area,,,Replant,,GROWING COFFEE,people's schedules for other things,Time,,Poor Committment,TEACH THEM THE ADVANTAGES OF CARRYING OUT GOOD FARMING PRACTICES,Share benefits,,,,,,,,"ADDED MANURE, PRACTICED MULCHING",,,,,,,,,,,,
123,How prevent coffee pests and diseases,Training,Pest management,,,,,,,to be taught and funding,Finance,,,Training,,,,diseases,Pests,,,,,,,,I always consult my fellow farmers and extention workers,Support ,Other farmers,,,,#NAME?,people in the community do ask for sitting allowances,Per Diem,,,schedule one day for the training,Training,,Coordination,,,,,,INCREASED HARVEST,,,,,,,,,,,,
124,goat raring,Livestock,Goats,,,,,,,l have no idea.,,,,,,,,"coffee wilf and Bctb, lack of maure",Pests,,Inputs,Fertilizer,Manure,,,,I uproot the coffee plant that has wealt and burn it.,Cut & Burn Affected Area,,,,,WOULD SHARE ABOUT CONSTRUCTING COMPOST PITS,The members may ask for drinks and stationally,Per Diem,,,Training on these ideas,Training,,,,,,,,FAVOURABLE WEATHER,,,,,,,,,,,,
125,training on use of organic manure,Training,Soil management ,Organic,,,,,,The society should give us Robuster coffeee.,Inputs,Seedlings,,,,,,labour,Labour ,,,,,,,,I uproot the coffee plant that has a disease and burn it. and then replant a new one.,Cut & Burn Affected Area,,,Replant,,MULCHING,many are redudunt to adopt,Fellow farmers do not accept training,,,provide him with stationally,Per Diem,,,,,,,,PESTS AND DISEASES LIKE THE BANANA WILT DISEASE,,,,,,,,,,,,
126,more training on coffee spacing and growing,Training,Good agricultural practices,,,,,,,getting loan,Finance,,,,,,,weather changes,Weather,Changing,,,,,,,I consult the extention farmers for advice.,Support ,Extension officers,,,,WOULD GIVE THEM IDEAS ON HOW TO IMPROVE OUR FARMING SKILLS SO THAT OUR COMMUNITY AND CO-OPERATIVE DEVELOP,"poor attendance to trainings, reluctant to implement",Fellow farmers do not accept training,,Poor Committment,set demo & trainings,Demonstration farm,,Training,,,,,,EARLY PLANTING,,,,,,,,,,,,
127,training on how to prevent coffee diseases,Training,Pest management,,,,,,,getting loan from the society,Finance,Farmer groups,,,,,,limited labour,Labour ,Shortage,,,,,,,I normally cut burn coffee plant that is already affected.,Cut & Burn Affected Area,,,,,WOULD TEACH THEM TO BURN AFFECTED PLANTS,poor turn-ups for trainings,Poor Committment,,,"give start up capital, give training perdiem",Per Diem,,,,,,,,EDUCATION/TRAINING FROM FARMER TRAINERS,,,,,,,,,,,,
