,Q147.OtherInfoAreas,Q147.OtherInfoAreas.Reponse1.Level1,Q147.OtherInfoAreas.Reponse1.Level2,Q147.OtherInfoAreas.Reponse1.Level3,Q147.OtherInfoAreas.Reponse2.Level1,Q147.OtherInfoAreas.Reponse2.Level2,,Q147.OtherInfoAreas.Reponse3.Level1,Q148.IdeasOfChanges,Q150.HelpToImplementChanges,Q150.HelpToImplementChanges.Reponse1.Level1,Q150.HelpToImplementChanges.Reponse1.Level2,Q150.HelpToImplementChanges.Reponse1.Level3,Q150.HelpToImplementChanges.Reponse2.Level1,Q150.HelpToImplementChanges.Reponse2.Level2,Q150.HelpToImplementChanges.Reponse3.Level1,Q150.HelpToImplementChanges.Reponse3.Level2,Q162.MainChallengesOnFarm,Q162.MainChallengesOnFarm.Reponse1.Level1,Q162.MainChallengesOnFarm.Reponse1.Level2,Q162.MainChallengesOnFarm.Reponse2.Level1,Q162.MainChallengesOnFarm.Reponse2.Level2,Q162.MainChallengesOnFarm.Reponse2.Level3,Q162.MainChallengesOnFarm.Reponse3.Level1,Q162.MainChallengesOnFarm.Reponse3.Level2,Q162.MainChallengesOnFarm.Reponse4.Level1,Q163.SolutionsToAddressProblems,Q163.SolutionsToAddressProblems.Reponse1.Level1,Q163.SolutionsToAddressProblems.Reponse1.Level2,Q163.SolutionsToAddressProblems.Reponse1.Level3,Q163.SolutionsToAddressProblems.Reponse2.Level1,Q163.SolutionsToAddressProblems.Reponse2.Level2,Q166.ShareNewFarmingPractice.Example,Q170.ChallengesOfSharingInfo,Q170.ChallengesOfSharingInfo.Reponse1.Level1,Q170.ChallengesOfSharingInfo.Reponse1.Level2,Q170.ChallengesOfSharingInfo.Reponse2.Level1,Q171.MakeSharingEasier,Q171.MakeSharingEasier.Response1.Level1,Q171.MakeSharingEasier.Response1.Level2,Q171.MakeSharingEasier.Response2.Level1,Q21.Income.Other,Q21.Income.Other.Reponse1.Level1,Q21.Income.Other.Reponse1.Level2,Q21.Income.Other.Reponse2.Level1,Q21.Income.Other.Reponse2.Level2,Q28.FarmHealth.Text,Q93.BankAccountChallenges,Q93.BankAccountChallenges.Reponse1.Level1,Q93.BankAccountChallenges.Reponse2.Level1,Q95.BankLoanFacilityChallenges,Q95.BankLoanFacilityChallenges.Reponse1.Level1,Q95.BankLoanFacilityChallenges.Reponse1.Level2,Q95.BankLoanFacilityChallenges.Reponse2.Level1,Q97.BankCreditChallenges.Reponse1.Level1,Q99.SACCOChallenges,Q99.SACCOChallenges.Reponse1.Level1,Q99.SACCOChallenges.Reponse1.Level2,Q99.SACCOChallenges.Reponse2.Level1
,,,,,,,,,,,,,,,,,,,,,,,,,,,,,,,,,,,,,,,,,,,,,,,,,,,,,,,,,,,
0,Information about new farming technics,Good agricultural practices,,,Training,New ideas,,,2,if i get more capercity building,Training,,,,,,,limited farm inputs,Inputs,Limited,,,,,,,Not yet sofar,None,,,,,vist farmers direct,some farmers are not co operative,Poor Committment,,,talk to farners about the benrfits,Share benefits,,,pat labour,Wages,,,,its amall and i have over used it,non,-1,,profits are high,High Interest,,,,Delay on payment from the factory,Delayed Payment from Cooperative,,
1,,,,,,,,,1,Capacity building in cattle treating,Training,Livestock,,,,,,finance to support my farm,Finance,,,,,,,,i ask for loans from SACCOs,Finance ,SACCO Loan request,,,,I would share how can one come up with ideas,best time to get farmers would be a challenge,Time,,,come up with workplan n working together with the farmers,"Work with a group, make a shared plan",,,paying workers,Wages,,,,we dont get manuel,High interest rates,High Interest ,,we get money late,Delayed Loan,,,,still profits are high,High Interest,,
2,record keeping and best way to get good products of tea,Record keeping,,,Farm management,,,,,Not answerd,,,,,,,,getting fertilizers for better tea produces,Fertilizer,Limited,,,,,,,Have come up with income generating activities,Innovation ,Income generating activiteis,,,,mobilise farmers on the centres and talk to them,transport costs and timing,Travel,,Time,Work with fellow farmers to provide time,"Work with a group, make a shared plan",,,investments,Farm Costs,,,,Its not fertile,delays in getting the loan,Loan Delays,,i dont face any challenge,No Challenge,,,,we dont get enough money from SACCOs,Insufficient Disbursement Amount,,
3,i want to go on expossure vists,Training,Farm demonstrations,,,,,,,Not answered,,,,,,,,"soil fertility 
and 
price fractuation",Soil mangement,Fertility,Prices,Price fluctuation,,,,,We use local organic fertilizers,Fertilizers,Organic,,,,Best practices,Most farmers dont turn up,Poor Committment,,,get modal farm in our community,Demonstration farm,,,paying for labour,Wages,,,,fertility is the same,"ghdhsjf
hshshsjsj
jjdjdhso",-1,,many to pay back is a challenge,Repayment Hard,,,,intreasts rates are so high,High Interest,,
4,best way to treat cows,Livestock,Dairy,,,,,,,Good information if given to me,Information,,,,,,,farm inputs and coffee diseases,Inputs,Limited,Pests,,,,,,using of local fertilizers,Fertilizers,Local ,,,,,farmers dont turne up.,Poor Committment,,,To work with serious farmers,Committed Farmers,,,improving my farm,Farm Costs,,,,Fertility is poor,if i get low yields its not easy to pay back the loan.,Farming Challenges,Loan Repayment,i fail to pay in time becouse i delay to get money from the Factory,Repayment Hard,,Delayed Payment from Cooperative,,paying back is challenging due to tea price change,Repayment Hard,Price Shocks,
5,Advise about improved farming,Training,Good agricultural practices,,,,,,,get support from farmer organisatiop,Support,,,,,,,farm inputs and Financial support,Inputs,Limited,Finance,,,,,,Have not come up with any,None,,,,,the exact information i get  from the source,,,,,,,,,pay workers,Wages,,,,land is infertile,,,,"High interest rate and background checks where they take photos of all your property.
They also do not give exactly what we ask for,they give less.",High Interest,Lower amount distributed,Background Check,,No challenges,No Challenge,,
6,market strategies on regional level,Marketing,,,,,,,,getting financial support would help,Finance,,,,,,,soil fertility,Soil mangement,Fertility,,,,,,,apply of local feryilizers,Fertilizers,Local ,,,,information n ideas,financail challengesp,Costs,,,if given means if movement to meet farmers,Funding to travel,,,house hold requirmentd,Daily Expenses,,,,Infertility,,,,"high interest rates.
change of seasons and we fail to pay in time",High Interest,,,,they delay to give us the money.cant give large su,Delayed Disbursement,,Insufficient Disbursement Amount
7,"how to keep more fertility on our soils and 

informatio  about new crops",Soil management ,,,Information,New crops,,,,Geting enough information,Information,,,,,,,"soil fertility 
weeds",Soil mangement,Fertility,Weeds,,,,,,use local fertility,Fertilizers,Local ,,,,i would share knowledge,negative attitude,Poor Committment,,,routine sensitization,Sensitization,,,Invest it in trading,Investment,,,,pests and diseases,,,,I get money and time normally runs out for taking back the money since farming is seasonal,Repayment Hard,Farming Challenges,,,Many fraudulent people,Fraud,,
8,more information about Challenge that we face everyday,Information,,,,,,,,Good training and financial support,Training,,,Finance,,,,soil fertility and limited information,Soil mangement,Fertility,Information,Limited access,,,,,geting help from other farmers,Support ,Other farmers,,,,Knowledge,Some farmers dont show intreast,Poor Committment,,,more senstization,Sensitization,,,ivestments,Investment,,,,its not fertile enough,,,,Pay back is very challenging.,Repayment Hard,,,,High interest rates,High Interest,,
9,Where a farmer can get cheap farm inputs,Inputs,Affordable,,,,,,,geting enough land,Inputs,Land,,,,,,"Fertilizers
pests and diseas",Inputs,Fertilizer,Pests,,,,,,we use local cheap methods like mulching,Fertilizers,Local ,Mulching,,,Information,farmers are hard to get,Time,,Logistics,find them on their farm,Visit Fellow Farmers Farms,,,"telephone,radio batteries",Telephone,Radio Batteries,,,the land has been over used,,,,high interest rate,High Interest,,,,No challenges yet.,No Challenge,,
10,How best to manege water,Water management,,,,,,,,more information and materials,Inputs,Materials,,Information,,,,Soil manegment,Soil mangement,,,,,,,,come up with local solutions,Innovation ,Local solutions,,,,about information,Farmers are ever busy,Time,,,working in a group,"Work with a group, make a shared plan",,,looking after the farm,Farm Costs,,,,its still fertile,,,,high interest rates and long distances to the banks.,High Interest,,Long Distance,,The loan given is based on the coffee quantity,Farming Challenges,,
11,New farming methods,Training,New ideas,,Training,Good agricultural practices,,,,intervation from farmer supporters,Training,,,,,,,Tea price is low we cant afford the workers,Prices,Low prices,Labour ,Costs,,,,,we sale tea to other buyers,Sell,Tea,,,,new ideas and information,Fercilition of trainers interms of material to use,Lack of information/resources/demonstrations,,,work with Government,Work with government ,,,Medicine for animals,Livestock,,,,What i grow dont  come out well,,,,high interest rates,High Interest,,,,Access to a loan that is less than what i want,Insufficient Disbursement Amount,,
12,how to grow other better crops apart from tea,Information,New crops,,Training,,,,,more and constant trainings.,Training,,,,,,,"price fracturation 

Pestsides",Prices,Price fluctuation,Inputs,Limited,,,,,use money for other activities to fercilitate the other,Innovation ,Income generating activiteis,,,,idears,materiald to use,Lack of information/resources/demonstrations,,,Talk to our farmer leaders,Farmer Promoters,,,water,Water,,,,the weather keeps changing,,,,"It takes time to get aloan
High interest rate",High Interest,Disbursement Timeline,,,delay in accessing the loan by the SACCO,Delayed Disbursement,,
13,Information about new farm inputs and how to apply them,Information,Inputs,Use of inputs,,,,,,Farmers associations to help us with money so as to carry out these ideas,Finance,,,,,,,LOW PRICE OF TEA is a challenge,Prices,Low prices,,,,,,,Non,None,,,,,what i hv learnt,l will have no challenge becouse am very prominate person in this community,No Challenges,,,working with other stake holders,Work with other stakeholders,,,"buying manures,mulches",Farm Costs,,,,Soil infertility,,,,"BANKS DO NOT LOAN OUT THE EXACT MONEY REQUESTED FOR.
MONEY IS USUALLY REDUCED",Lower amount distributed,,,,no challenges,No Challenge,,
14,More information about market,Information,Markets,,,,,,,We would like to be provided with loan facilities from our societies with good interest rates.,Finance,,,,,,,less man power and finance,Labour ,Shortage,Finance,,,,,,saling part of my land to support my farm,Sell,Land,,,,information,Farmers dont show up,Poor Committment,,,use other options,NA,,,home basics,Daily Expenses,,,,Soil is still fertile,,,,HIGH INTEREST RATES,High Interest,,,,no challenge apart from uncertainities.,No Challenge,,
15,information on market,Information,Markets,,,,,,,To help us get easy access to government support or agricultural bodies.,Government access,,,,,,,Financial challenges,Finance,,,,,,,,Not thought of any solution,None,,,,,To also improve their ways of farming so that they can both improve their household income,material to be used,Lack of information/resources/demonstrations,,,come at one center piont,Demonstration farm,,,building,Investment,,,,soil infertility,,,,farmer hasnt faced any problem,No Challenge,,,,delays in the time taken to get the loan.,Delayed Disbursement,,
16,Advise about my farming activities,Training,Farm management,,,,,,,providing us with pesticides to eradicate the diseases,Inputs,Agrochemicals,,,,,,labour costs and fertilizers,Labour ,Costs,Inputs,Fertilizer,,,,,we have no solution,None,,,,,"i would teach them how to mulch and also plant trees which will provide a shade for the crops.
making their own manure from gabbage.
removing spoilt coffee trees from plantations.",Transporting my self to other farmers,Travel,,,NOn,NA,,,mulching,Farm Costs,,,,Soil fertility is low,,,,HIgh intrest rates.,High Interest,,,,grace period is little,Repayment Hard,,
17,more information about tea,Information,Tea,,,,,,,"most times i do things on my own on the farm but when i feel i can nolonger handle alone,i find more help.",Support,,,,,,,have less output in tea production,Crops,Low productivity,,,,,,,have no option,None,,,,,"Especially on the coffee diseases,i can teach them on how to fight it so that we later have good produce as farmers",NO CHALLENGE,No Challenges,,,none,NA,,,farming,Farm Costs,,,,the soil fertility is not changing,,,,no challenge,None,,,,It takes some time to get a loan in you apply.,Delayed Disbursement,,
18,to experiance in good farming methords,Training,Good agricultural practices,,,,,,,If iam given financial assistance i would easily be able to carry them out.,Finance,,,,,,,We low income againest the expendictures,Income,Low,Vs Expenditures,,,,,,i just have to work so harder to bridge the gup,Work harder,,,,,All the information i have got so as to work together as a group for better yields.,Non,No Challenges,,,na,NA,,,Farming,Farm Costs,,,,The land is still fair,,,,the bank needs a lot of security anf alot of bureacy to access a loan,Background Check,Disbursement Timeline,,,High interest rate,High Interest,,
19,information on grazzing,Information,Livestock,Grazing,,,,,,To train me in ways that can ease my farming so that i increase my production capacity,Training,Yield improvement,,,,,,the price of tea keeps on changing,Prices,Price fluctuation,,,,,,,Not yet,None,,,,,I would tell them whatever i have been taught,No challenge,No Challenges,,,make sure i talk to farmers one by onep,Visit Fellow Farmers Farms,,,Helping others who need help.,Helping Others,,,,Poor state of land,,,,farmer has not got any challenge,No Challenge,,,,"High interest rates
Needs collateral security",High Interest,,
20,Grazing training,Information,Livestock,Grazing,,,,,,more trainings.,Training,,,,,,,fertilizers for tea,Inputs,Fertilizer,,,,,,,timmly weeding,Farm management,Weed control,,,,i would tell the how to dig a hole put in waste products and keep feeding our crops,Mobilising farmers is the main challenges,Poor Committment,,,To keep encouraging them and not get tired,Committed Farmers,,,My shop,Investment,,,,soil fertility,,,,we dont get monet in time and alot of secutity,Delayed Loan,,Background Check,,No big challenge,No Challenge,,
21,information about bee keeping,Information,Bee keeping,,,,,,,Help on how to make my own fertilizers and where to get wastes.,Inputs,Fertilizer,Homemade,,,,,Fertilizers and price changes,Inputs,Fertilizer,Prices,Price fluctuation,,,,,use other posible ways,Other options,,,,,"i would tell them that inorder to combat the pests and diseases affecting coffee,they should cut thr affected pieces and burn them. and they can only do this by going through their farms everyday",Some members take long to understand and do what you are doing,Communication,,Poor Understanding,Alot of sensitization and trainings,Sensitization,,,LABOUR,Wages,,,,we dont have fertilizers,,,,they require alot of security and increased rates of intrests,High Interest,,Background Check,,No challenge,No Challenge,,
22,coffee information,Information,Coffee,,,,,,,"More training and workshops.
To also be taken to demostration farms and tours outside our locality.",Training,Farm demonstrations,,,,,,Fertilizers,Inputs,Fertilizer,,,,,,,He contrals weed,Farm management,Weed control,,,,"when they come to my farm and feel like learning,i can teach them.","Some are slow in implementing new ideas,they only do when they see my results",Lack of information/resources/demonstrations,,People lack necessities to implement new skills,Increased sensitization and trainings.,Sensitization,,,MY CHILDREN,Family,Children,,,we have no faterlizers,,,,too much intrest rates,High Interest,,,,At times it takes time to get the loan,Delayed Disbursement,,
23,We apply manure but qe dont know the soil we have so i need more informatio  about manure,Soil management ,Soil quality analysis,,Inputs,Compost,,,,To be given assistance through loans from our farmer groups,Finance,Farmer groups,,,,,,"labour cost is so high 
financial challenges",Labour ,Costs,,,,,,,come up with other generating activities like growing of bananas for sale,Innovation ,Income generating activiteis,Bananas,,,How they can prune their coffee and make it yield better produce,Some do not take on the information because they do not believe.,Fellow farmers do not accept training,,,To be provided with transportation and easy and accessible means of communication.,Funding to travel,,Communication,BUYING LAND,Land Purchase,,,,i didn't buy fertilizers this year,,,,makes get broke for some time after paying the loan,Repayment Hard,,,,If you dont have shares you get less money,Insufficient Disbursement Amount,,Shares
24,Continued support on improved farming,Training,Good agricultural practices,,,,,,,"helping me with wheel barrows,drying materials and hoes.",Inputs,Equipment,,,,,,"1.Pests and diseases and we have not found pestcides.
2.Alot of drought.
3.price fluctuations",Pests,,Weather,Drought,,Prices,Price fluctuation,,come up with activities that can generate money,Innovation ,Income generating activiteis,Bananas,,,when you grow coffee leave a space between them and always attend to them for better results.,I lack transport for going to different cells so as to be able to teach everyone.,Travel,,,alot of sensitization and give them like hoes and seedlings.,Sensitization,,,PAYING CASUAL LABOURERS,Wages,,,,working hard and trainings,,,,"late payment, low production from main cash crop",Repayment Hard,Farming Challenges,,,"High interest rates
High charges",High Interest,,
25,has no idea,,,,,,,,,"when given support interms of money,tools and manure i can be able to carry out the ideas because i love farming.",Finance,Implement new ideas,,Inputs,Equipment,,,most want Government to help them with money so as to implement these changes,Finance,,,,,,,,informing organic field officers to help us find pesticides for the pests and diseases affecting our coffee,Support ,Extension officers,,,,"How we can bend the trees and cuy the over grown ones and how to prune.
And how to harvest well.",some do not follow up and adopt the ideas that i share,Poor Committment,,,increase trainings in societies,Training,,,PAYING CASUAL LABOUR,Wages,,,,Trainings and change agents.,,,,low income got from tea so it becomes hard to pay back in time,Repayment Hard,Farming Challenges,,,Distance to reach the Sacco is far,Long Distance,,
26,I would love to own a generator to start irrigating during the dry season or other methods.,Water management,Irrigation,,,,,,,when am given some financial assistance.,Finance,,,,,,,Soil erosion,Soil mangement,Soil erosion,,,,,,,"About drought they have taught us to plant trees and also mulch so as to help in water retention.
they have also taught us how to plan bananas 2-2inches to fight drought.
they also tell us to completely destroy crops with diseases.",Tree planting,,,Pest management,,When i visit or meet them i can share with them,no challenges,No Challenges,,,To train them to be quick adopters,Training,,,WATER,Water,,,,We were trained on improved ways of farming,,,,"repayment terms, high interest rate",Repayment Hard,,High Interest,,,,,
27,"Babbed wire for my farm,pesticides.
To be taught more improved ways of farming.",Pest management,,,Fencing,,,Good agricultural practices,,Help ne with money,Finance,,,,,,,"Water is very far and wild animals attack my animals.
would also love to adopt mechanized farming but lacks tools like tractors.",Water,Access,Inputs,Equpiment,,Pests,Animal attacks,,planting trees,Tree planting,,,,,I would tell them exactly what i was taught,no challeges,No Challenges,,,Increase trainings so that we get to share ideas.,Training,,,BUYING LIVESTOCK,Livestock,,,,because of drought which affected animals and crop,,,,delay payment because of late payment from the factory,Repayment Hard,,Delayed Payment from Cooperative,,At times some SACCOS donot have sufficient money,Insufficient Disbursement Amount,,
28,"i do not have enough knowledge about most of the crops am growing,i need more training",Training,Good agricultural practices,,,,,,,more trainings on how i can overcome the challenge.,Training,,,,,,,lack of money to grow,Finance,,,,,,,,"We have made local fencing like using wood.
we also use small hoes for digging",Fencing,,,Equipment,,I would tell them and explain until they understand,People do not take what others have shared because people dont like each other.,Communication,,,Alot of sensitization.,Sensitization,,,LIVESTOCK PROJECTS,Livestock,,,,because of alot of drought this year,,,,sometimes when it is time to pay back find have not yet got the money so am forced to sell my animals to pay loan,Repayment Hard,,,,Some SACCOS lack money in case you want millions,Insufficient Disbursement Amount,,
29,"us as coffee gtowers,they normally give us seedlings and many more support but most times they do not get to all of us",Inputs,Seedlings,,,,,,,financial assistance with low interest rates,Finance,Low interest loans,,,,,,There are alot of weeds compared to someone who mulches,Weeds,,,,,,,,i get some loans from farmer groups,Finance ,Loans,,,,I would call all of them and teach me the same way i was taught.,Sometimes others agree with the idea and others disagree,Fellow farmers do not accept training,,,through more trainings and visiting more farmers,Training,,Visit Fellow Farmers Farms,trasport costs,Travel,,,,alot of sunshine,,,,delay payment from factory,Delayed Payment from Cooperative,,,,It takes time to get a loan in case of a need,Delayed Disbursement,,
30,Inputs interms of finances,Inputs,,,Finance,,,,,To be given financial assistance.,Finance,,,,,,,Pests and diseases affecting coffee,Pests,,,,,,,,i keep adding waste products and working on my firm as always,Work harder,,,Add waste products,,I would tell them exactly what i have been taught,Some do not mind and just ignore the ideas.,Fellow farmers do not accept training,,,Increase trainings,Training,,,labour,Wages,,,,Alot of sunshine,,,,delay in paying back,Repayment Hard,,,,Takes time to get loan,Delayed Disbursement,,
31,how to work on my banana plantation,Farm management,Bananas,,,,,,,When am given financial assistance.,Finance,,,,,,,Pests and diseases are my main problem,Pests,,,,,,,,i always try to cut the affected areas and burn them,Cut & Burn Affected Area,,,,,I would tell them do this and that to get this just ad i have been taught,Low adoptation,People lack necessities to implement new skills,,,more trainings,Training,,,land purchase,Land Purchase,,,,drought,,,,late payment because of delay payment from tea,Repayment Hard,,Delayed Payment from Cooperative,,At times they demand collasteral security,Collateral,,
32,"I need more training on modernized farming methods.
How to plan on how to fully utilize my farm.",Training,Good agricultural practices,,Farm planning,,,,,To equip me with more skills.,Training,,,,,,,i use a panga which makes it difficult for my work,Illness,,,,,,,,i have not yet,None,,,,,I would teach them as i have been taught and also add some more innovation on our farms.,No challenges,No Challenges,,,More trainings,Training,,,buy land,Land Purchase,,,,change in weather,,,,donot have any problem,No Challenge,,,,High interest rate within a short period of time,High Interest,,
33,Fertilizers for my crops.,Fertilizer management,,,,,,,,Helping me with finances and fertilizers and machines to plant.,Finance,,,Inputs,Equipment,Inputs,Fertilizer,Coffee pests and diseases and banana diseases.,Pests,,,,,,,,I use a panga,,,,,,All that i have been taught i would teach them.,some refuse to gather and be taught.,Poor Committment,,,To reach each and everyone and take time to explain to them so that they understand.,Share benefits,,,And basic needs,Daily Expenses,,,,Drought and lack of waste for fertilization,,,,late payment,Repayment Hard,,,,It delays to get money in case of emergency,Delayed Disbursement,,
34,"Type of trees suitable for my coffee,the best chemical which we can use in spraying which are not harmful to people and the soil.",Trees,,,Soil management ,,,Pest management,,When i get enough training and guidance regarding mulching practices.,Training,Mulching,,,,,,"Pests and diseases,natural hazards,thieves,lack of mulches and manure and labourers,drying materials are not enough",Pests,,Inputs,Fertilizer,Mulching,Labour ,Shortage,,I normally break off the affected area and burn them.,Cut & Burn Affected Area,,,,,I would tell them exactly how we have been told to improve our farming methods and increase our yields.,No challenge except more knowledge is shared,No Challenges,,,to show them how to work,Training,,,House hold care mainly,Daily Expenses,,,,"Because of mulching,use of fertilizers",,,,alot of bueracracy,Background Check,,,,At times they give us less money than we request,Insufficient Disbursement Amount,,
35,How to take good care of coffee,Training,Good agricultural practices,Coffee,,,,,,"Being given subsidised tools for using in the farm like hoes,pangas,wheelbarrows and many others.
pesticides for fighting the pests.",Inputs,Equipment,,Inputs,Agrochemicals,,,"Lack of finances.
Pests and diseases",Finance,,Pests,,,,,,Seeking for advise from agricultural officers,Support ,Extension officers,,,,I would encourage them to also adopt the new idea so thay we can all benefit from the new farming method.,no challenge,No Challenges,,,More trainings and seminars,Training,,,I also invest in business,Investment,Micro-enterprise,,,Drought,,,,,,,,,"At times they give 
loans depending on shares",Insufficient Disbursement Amount,Shares,
